Text,Top5%,Emoji_1,Emoji_2,Emoji_3,Emoji_4,Emoji_5,Pct_1,Pct_2,Pct_3,Pct_4,Pct_5
Be a Miracle to someone #hurricaneharvey #hustonstrong @ Monmouth…,0.32536694779992104,21,63,17,53,33,0.1419519,0.052944884,0.048723657,0.042413063,0.03933344
And so it begins ... #hurricaneharvey #preparefortheworsthopeforthebest #lovedbytheking…,0.2298280354589224,57,44,58,61,54,0.07691115,0.04929682,0.039762236,0.033420067,0.030437762
"The rain from #Hurricane #Harvey has started @ Atascocita, Texas",0.22723644226789474,61,12,4,17,33,0.051379725,0.051184863,0.044743933,0.04090185,0.03902607
#harvey2017 es ahora una tendencia en Mexico,0.17508233711123466,55,57,32,40,34,0.04159506,0.0352641,0.03331419,0.032481365,0.03242762
Pizza prep! Tying up loose ends on hurricane prep! #hurricane #beers #pizza #hurricaneharvey…,0.33264095336198807,57,33,54,53,31,0.097986646,0.076990776,0.05973519,0.05151358,0.046414763
"Having a Giant Supersized Red Bull. Blame Julian Edelman's knee, IT's hip, the #RedSox, #HurricaneHarvey & petty Trump politics (#Resist) Xp",0.1621617116034031,0,19,25,44,31,0.040297076,0.033962127,0.029577237,0.029181039,0.029144233
"Yeah he runs this. #BigH #hurricaneharvey #evacuee @ Kenswick Forest, Humble, Texas",0.2888023294508457,57,40,11,17,33,0.060545463,0.058833443,0.057336055,0.05687197,0.0552154
Volunteering rmhcctx #rmhcctx #betterinbryan #hurricaneharvey @ CHI St. Joseph Health,0.24697208032011986,57,33,53,7,16,0.08206763,0.044141598,0.042535704,0.03956193,0.038665216
Irrational responses to floods of biblical proportions - Make a cherry pie #hurricaneharvey @…,0.2008117511868477,39,36,52,11,33,0.053326726,0.042564426,0.040604018,0.032797858,0.031518724
Stay safe and dry families. He's got this. #sml1718 #besml #melldro #luthed #hurricaneharvey @…,0.5073778666555882,21,57,61,58,8,0.15595566,0.15252452,0.091254696,0.05498603,0.052656967
When he speaks to you.... Speak back!!!#htown #hurricaneharvey #beachlife #summertime…,0.183550626039505,4,17,33,57,24,0.044798918,0.037703604,0.036494102,0.032649845,0.031904157
"#prayer #prayforhouston 🙏🏻🙏🏻🙏🏻 #Harvey #Texas @ Northport, New York",0.2615168057382107,11,48,21,30,57,0.08922254,0.059107203,0.044174574,0.036079053,0.032933433
#Prayforhouston #fema #houston #harvey #HurricaneHarvey #weather #homeless #needhelp @ Las Vegas…,0.25561846792697906,11,48,57,21,30,0.08669744,0.054524265,0.043887686,0.03779238,0.0327167
"Our thoughts and prayers goes to the people of Houston, affected by the #HurricaneHarvey.. There…",0.678440235555172,21,46,34,5,61,0.38188317,0.10456029,0.07226475,0.06188769,0.057844326
Our hearts and prayers have been going out to all the cities affected from #hurricaneharvey !!…,0.6874021366238594,21,61,46,59,8,0.1887099,0.16103789,0.13900426,0.10054047,0.09810962
#hurricaneharvey @ Riverwood Estates,0.19128626957535744,57,11,24,58,48,0.04743903,0.043508828,0.03787433,0.03333221,0.02913187
"Through @funimation, I donated to @redcross to help those affected by #hurricaneharvey. This…",0.3885354623198509,21,61,33,8,59,0.09305685,0.08689422,0.08098577,0.06382901,0.06376961
Landing air craft apparently. #HurricaneHarvey @ Katy High School,0.2030380591750145,12,25,33,19,53,0.06927157,0.04042598,0.033703957,0.030908508,0.028728044
Huge S/O to my home girl for donating to #hurricaneharvey relief…,0.29894765466451645,21,17,7,8,16,0.073013425,0.06583303,0.055161703,0.053736787,0.051202707
"Daily sketch challenge #74, Houston Strong Icon, work in progress. #hurricaneharvey…",0.49320011399686337,57,58,33,30,62,0.3305475,0.058540054,0.045064524,0.031198172,0.027849853
#Foster carers needed in #Texas. Help @AustinHumane with resources for #HoustonFloods as they…,0.34497423842549324,33,21,50,40,34,0.13998878,0.06542082,0.05299107,0.04395706,0.04261651
"#Harvey rained on the 'Cue Crawl that was planned for the weekend, but a few places were open on…",0.34376411885023117,33,41,62,53,6,0.11025386,0.09678051,0.050857913,0.04528267,0.040589165
Crazy Lines To Get Gas In #Dallas #hurricaneharvey #wfaa #wfaanews8 #wfaanews @ QuikTrip,0.25657375529408455,12,20,62,54,31,0.09387126,0.046444304,0.04579763,0.036224745,0.034235816
It's truly beautiful out here! You can't see Hurricane #Harvey remnants until you look closely.…,0.2158185914158821,63,4,41,31,50,0.053237937,0.04616536,0.042451736,0.040155172,0.033808388
"😃Here's a FUN way to help those impacted by #HurricaneHarvey!🌊👩🏽👩🏼👩🏻Join Becky Uthe, Molly M.…",0.33035384491086006,33,57,61,50,53,0.10072661,0.07034951,0.060156375,0.050095305,0.049026046
🌧🌧🌧#HurricaneHarvey #michaelcwellsphotography #photography #photographer #photographers #rain…,0.23016303405165672,11,34,48,21,55,0.07297751,0.04440771,0.042255044,0.036727194,0.033795573
"Please stop by between 10 & 1 today, 8/2, for our #Texas #Harvey #Fundraiser #limitedEdition…",0.3009747080504894,21,61,63,57,59,0.13014936,0.059559565,0.0395152,0.03640834,0.03534224
Every little bit counts you guys. Help those in need. #hurricaneharvey #redcross #donate @…,0.28724876418709755,21,61,59,57,33,0.07882874,0.075521946,0.04599253,0.044866573,0.042038977
We're running a benefit campaign to help benefit #hurricaneharvey relief efforts!Proceeds…,0.34364136680960655,33,53,40,57,17,0.104939915,0.0679758,0.0672037,0.055530164,0.04799179
NASA astronauts are with us #hurricane #harvey #houston #houstonstrong @ NRG Center,0.20308062061667442,57,33,31,63,53,0.047478683,0.045129936,0.041019797,0.036254745,0.03319746
Roflmao shit #stupid #hurricaneharvey #hurricane #hurricaneirma #nochill #anime #otaku #weeaboo…,0.3698437660932541,55,32,37,42,58,0.1049222,0.086040296,0.06643136,0.057960704,0.05448921
"It's raining, it's pouring... #offtowork #hurricaneirma #hurricaneharvey #irmagerd #tailend…",0.4515160359442234,11,61,48,12,4,0.23188837,0.09109353,0.07711808,0.026186997,0.025229061
"#saftyfirst #hurrucaneirma #hurricanejose #hurricaneharvey @ Miami Beach, Florida",0.23064862936735153,31,30,24,4,47,0.066281006,0.049282204,0.04407852,0.037146214,0.033860683
Accident with injury in #Harvey on Westbank Expwy EB at Manhattan Boulevard #traffic #NOLA,0.32058490812778473,52,43,34,62,45,0.091763854,0.0687667,0.06837017,0.04711344,0.044570744
"The calm before the storm! #hurricaneharvey #houston #texas @ Houston, Texas",0.2517774701118469,61,33,31,11,17,0.072004035,0.04899228,0.04724167,0.045279864,0.03825962
Houston under #Harvey. #houstontx #storms @ Downtown Houston,0.35050615668296814,44,31,41,17,30,0.104142204,0.08218122,0.06561613,0.051275086,0.047291514
My Friday Night! Watching Hurricane Harvey.#HurricaneHarvey#TexasStrong#prayfortexas🙏 @…,0.2417825497686863,33,61,31,54,53,0.08768164,0.043485325,0.039911244,0.035873894,0.034830444
We have water #hurricaneharvey #walgreens #bryantx @ Walgreens,0.15969081781804562,53,10,33,57,54,0.036786802,0.03329386,0.03301349,0.028960323,0.027636345
#prayfortexas #hurricane #hurricaneharvey #harvey #pray #prayer #relief #usa @ Texas,0.532321248203516,21,40,34,11,57,0.42033505,0.030605698,0.029827865,0.026441727,0.025110904
"I always wanted a pool! This is in my backyard, stay safe HTown! #HurricaneHarvey @ Houston, Texas",0.2897455729544163,31,30,21,61,33,0.08532079,0.0732833,0.050775923,0.046704993,0.033660565
"#houstonflood #prayersfortexas We're staying inside, hoping everyone stays safe. Thanks for all…",0.4076707921922207,21,47,24,8,60,0.09992407,0.09459903,0.08888506,0.07079894,0.053463686
#HurricaneHarvey buy a shirt & help those in #dire need #TexasStrong…,0.19583001360297203,33,21,50,61,54,0.054289795,0.040242687,0.038415406,0.03420249,0.028679635
#HurricaneHarvey #Houston #Pray4Houston #PrayForHouston #HelpSomeoneHelpSomeone #Texas @…,0.21877072378993034,11,48,57,34,21,0.072111875,0.04743079,0.038848054,0.03137416,0.029005844
Walgreens is opened and we are dangerously low on coffee! #efyouharvey #hurricaneharvey #harvey…,0.317234855145216,12,62,52,28,54,0.11550923,0.07541356,0.04650583,0.042455666,0.03735057
"La Grange, Texas. #Harvey @ City of La Grange",0.36872057244181633,11,48,24,61,30,0.17962329,0.06974414,0.049762774,0.035810743,0.033779625
@13lvlylvndrldy#13lovelylavenderlady #HurricaneHarvey #MidwivesRock #GHMA #Houston #Texas @…,0.20060202851891518,54,50,21,34,20,0.05000933,0.04249502,0.038975466,0.03574151,0.033380702
Donations are currently being collected to help victims of #HurricaneHarvey - If you would like…,0.2308896705508232,33,63,21,50,53,0.053064343,0.050850343,0.045160275,0.0422801,0.03953461
"No bajamos la guardia, seguimos informandoles sobre #Harvey Gracias por siempre estar en…",0.34078969806432724,57,50,24,40,58,0.17507367,0.047305226,0.044423986,0.03764212,0.036344696
Prayers for #HurricaneHarvey victims and the first responders in…,0.7135917246341705,21,46,61,34,5,0.46583328,0.090089455,0.06478983,0.049284626,0.043594535
When we didn't care about #HurricaneHarvey and talk shit about it and ate outside. Never doing…,0.432977506890893,56,38,30,26,19,0.26731226,0.071790986,0.037228867,0.029533457,0.027111938
"Sooo, after cabin fever with #HurricaneHarvey I decided to release this. #LinkInBio #tellafriend…",0.2112918309867382,33,11,31,39,63,0.05901003,0.04218688,0.037065424,0.036648903,0.036380596
#holidaybeach#rockport#texas#hurricaneharvey #hurricane #harvey#emergencyrelief@tzuchiusa…,0.2303432784974575,11,57,21,48,40,0.06491047,0.053050816,0.044316936,0.03689387,0.031171184
The calm before the storm/hurricane #Harvey @ The Beach on North Padre Island,0.28254104778170586,31,6,17,33,12,0.094944,0.054017574,0.048127614,0.047221623,0.038230237
Let me grab a few things I'll need for all these freaking calls I'll be getting this weekend. Lol. #harvey...,0.2542324885725975,44,9,54,37,30,0.07198017,0.058372997,0.04954755,0.037738066,0.036593705
"#NOAA #HurricaneHunters fly past the eye of #Hurricane #Harvey, which is expected to make…",0.2434002347290516,41,33,54,53,50,0.07861802,0.0506368,0.03874676,0.038474448,0.03692421
If anyone is interested I will be posting updates on #hurricaneharvey from our perspective here…,0.39635417610406876,7,33,63,53,50,0.09311293,0.08907956,0.0757311,0.07151204,0.066918544
