Text,Top5%,Emoji_1,Emoji_2,Emoji_3,Emoji_4,Emoji_5,Pct_1,Pct_2,Pct_3,Pct_4,Pct_5
Welcome to NY hurricane Arthur. I'm just not in the mood #youwontmakeithere #keepitmoving #nyc @ Upper… http://t.co/34NwG5vfTW,0.2681466415524483,55,32,27,22,34,0.064622454,0.059144437,0.053208046,0.048040807,0.043130897
I'm at Hurricane Irene (Lorton) w/ 36 others http://t.co/4YfZ8N6,0.15188298746943474,16,24,20,53,47,0.031293035,0.031278197,0.031146012,0.030181896,0.027983848
"Hurricane Irene... Shit's outta control, strong ass winds... And my ass is on duty today... Smh.",0.2712052948772907,19,1,52,45,43,0.07772761,0.054587502,0.047164682,0.046195522,0.04552998
Met an old colonel from 3 cheshire today. .  In Dukinfield.  He in regimental tie. . #smallworld  . stand firm strike hard,0.41799966990947723,33,58,57,31,40,0.15002662,0.09250331,0.08661704,0.045131467,0.043721236
@aSandyHurricane you're making it feel like The Day After Tomorrow #hurricane #Sandy http://t.co/ZwChCz3Z,0.15995865128934383,3,34,49,50,0,0.0445873,0.034873668,0.026863499,0.02685971,0.026774475
"Due to the effects of Hurricane Matthew, for this week only we are offering a more concise menu… https://t.co/BJikKJNaJ9",0.2336633913218975,19,25,62,20,12,0.05842141,0.050563317,0.042741742,0.04124441,0.040692512
Watching the clouds and rain come this way (@ Hurricane Irene Projected Path w/ 453 others) [pic]: http://t.co/cBDiSAb,0.3045373037457466,24,47,63,61,8,0.1334148,0.062584266,0.039144937,0.035012573,0.034380723
"#Arthur is now a cat 2 #Hurricane with winds of 100 mph, gusting 115 mph, min. pressure of 976mb  http://t.co/ltH2faOMQn",0.37861931696534157,32,55,62,37,12,0.14205317,0.09991209,0.047780395,0.045158617,0.04371504
I should probably start stocking up for hurricane sandy that's coming in tonight,0.4151694141328335,62,20,12,10,28,0.11257732,0.106039956,0.080906965,0.06295213,0.052693043
My prayers and thoughts are with everyone affected by hurricane sandy. #staysafe.,0.6634634137153625,21,46,61,8,34,0.34734416,0.11511243,0.08429284,0.058870506,0.05784348
New Providence Chiropractic participates in Hurricane Sandy relief efforts http://t.co/PaHpuDzu via http://t.co/lCK3CKas,0.34147731587290764,33,53,40,7,20,0.11873012,0.074077986,0.07132436,0.042322353,0.035022493
Hurricane #sandy  @ Avon Pavilion http://t.co/nhDyEr61,0.1837499998509884,24,11,30,33,53,0.043792833,0.038239084,0.03608888,0.035510287,0.030118916
Get prepared now people...“@cnnbrk: New Jersey governor declares state of emergency in advance of Hurricane #Irene. http://t.co/5z5p3Qp”,0.20935891941189766,55,32,40,25,33,0.056061327,0.047558393,0.03657815,0.034832112,0.034328938
"Hurricane Sandy, Winter Storm Hybrid Threatens New York, Delaware, Maine With Bad Weather: via HuffPost http://t.co/ez8psQNo",0.20897988229990005,52,32,33,55,11,0.04469655,0.042979352,0.04143683,0.041164294,0.038702857
"Hahahaha. RT @VINNYGUADAGNINO: Hurricane Irene was sponsored by Target, Walmart, Costco and all of your major gas stations.",0.3085720017552376,0,12,25,19,53,0.08820671,0.075645894,0.05307094,0.046956778,0.04469168
Hy bang nche ma bang agam (‾⌣‾)♉ RT @nchebelajar: RT @MeutuahAgam: Lama tak jumpa.. Lama tdk akan brjumpa.. http://t.co/FRmzU6s,0.3116043098270893,16,34,24,45,35,0.12411813,0.05540788,0.05155342,0.043349016,0.037175864
@safybh hurricane Irene this weekend,0.2660476863384247,44,31,41,62,10,0.06637766,0.058886856,0.056069613,0.045140438,0.039573118
Waiting it out (@ Hurricane Sandy w/ @hollyann1220) http://t.co/TSVHrrAT,0.2002452053129673,24,41,47,62,54,0.05300043,0.038394496,0.038272597,0.0365331,0.034044582
Stafford Man Found Dead; Hurricane Sandy Ravaged House http://t.co/BqFG89h7 via http://t.co/kL2IR8pi,0.3201031722128391,12,51,34,0,22,0.094429396,0.090543486,0.057091556,0.03931644,0.038722295
@NBCNews this is an old photo of a hurricane from a different year. Not #Arthur !!!  Please fix!,0.36345240846276283,34,32,55,52,27,0.11796352,0.06784123,0.065071,0.06123339,0.051343262
Belle Haven Boaters Prep for Hurricane Sandy http://t.co/qcKKap7B via http://t.co/LxlQCwyH,0.30182480439543724,33,40,4,53,47,0.113337405,0.07124508,0.043816395,0.040237825,0.033188097
@MoriuhA we're twins. I swear our attitudes are identical. #ilovebeingabitch,0.2988842763006687,26,12,38,50,9,0.11328039,0.06521754,0.04568751,0.040611427,0.034087405
MOAR TEARS. MOAR TEARS. McKinley High School floods more on average than Hurricane Sandy flooded the north-east coast.,0.6041817218065262,34,46,3,35,45,0.30875516,0.10201892,0.0800442,0.06279182,0.05057162
"""@IvankaTrump: The calm before the storm. #sandy #hurricane http://t.co/J5lwxTQJ"" Multi Million $$$ view",0.26158416271209717,33,31,50,6,53,0.07654629,0.054165155,0.052632008,0.039568238,0.038672473
"RT ""@CNN: Hurricane Sandy could impact 60 million people - details live on @CNN TV and the CNN live blog: http://t.co/IEt9qUSb""",0.3572237901389599,33,40,24,16,41,0.09079459,0.07965038,0.070880644,0.068836786,0.047061387
"Are any local businesses still open in the storm? Grocery, gas, food? #Isaac #batonrouge",0.22410988807678223,41,53,62,54,33,0.053101994,0.052586917,0.040942702,0.039648924,0.03782935
"So it's now 'tropical storm irene', not as scary, sounds like a yummy smoothie.",0.41000915318727493,36,33,12,62,25,0.2221315,0.05484547,0.0467002,0.044844337,0.04148764
Hurricane Sandy: Restaurants and Bars Brazenly Stayed Open During Hurricane Sandy http://t.co/GiKy1x8W via http://t.co/Wx1pBux4,0.2578291967511177,33,12,31,40,53,0.0921163,0.04821753,0.04610808,0.037596516,0.033790775
"AFTERMATH: Hurricane Sandy Or Not, The Jersey Shore Still Voted http://t.co/mMsLzk4A via http://t.co/P0C0Jo92",0.1836918629705906,62,33,20,54,25,0.04353581,0.04089285,0.03404429,0.03288372,0.032335192
"Storm Surge, Inland Flooding Expected From Sandy http://t.co/TzBOSei9 via http://t.co/kG3TSZQG",0.2672283612191677,33,53,40,62,12,0.08912079,0.06047431,0.044360243,0.038054086,0.03521893
Hurricane Derek Sandy,0.2447156421840191,4,12,47,6,8,0.07402273,0.050905272,0.04158113,0.03954444,0.038662065
"I'm at Calm Before the Storm #irene (Moving Target!, New York) w/ 19 others http://t.co/R3FfrIl",0.23334559798240662,53,16,33,31,7,0.052279137,0.050737523,0.044306472,0.04430392,0.041718546
"I'm at El Comercio (San Isidro, Lima) http://t.co/ma3B84N7",0.19026164524257183,24,31,30,53,57,0.048762698,0.043918267,0.036366187,0.032765426,0.028449068
So what can you tell us about Hurricane Sandy Struggling Low Level Reporter? - IIIIIIIIT'SSSSSS WIIIIIIIIIINDYYYYYY!!!!,0.17867279052734375,22,25,54,20,62,0.042689826,0.037565913,0.036532372,0.03234238,0.029542297
"My room is a hot mess, looks like hurricane sandy hit just this room alone up! Need to pick up all these damn clothes",0.39499346911907196,55,32,37,19,29,0.097628884,0.09181399,0.07436658,0.067964956,0.06321906
#ff hurricane Irene @rachelsterne @NYCMayorsOffice @FDNYnews @fema @ReadydotGov @NYC_Buildings @nytimes,0.44117050617933273,24,47,8,60,33,0.17615315,0.10338704,0.06416731,0.04901666,0.04844634
New Englanders look to help Hurricane Sandy victims -NECN http://t.co/ogaTak00 #TenHills #Somerville #MA,0.2653502784669399,33,21,24,57,47,0.077477805,0.054256845,0.050960675,0.041714624,0.04094033
Hurricane sandy gaining strength man I hope she pounds east coast I would love to see some #weather action,0.2862727902829647,57,41,21,44,17,0.11162425,0.05458417,0.05054735,0.037679493,0.031837527
Support local Hurricane Sandy relief efforts https://t.co/UlB5lhKx via @DoGoodBklyn #bkfund #sandy cc: @cyu888,0.36461565643548965,33,40,24,57,16,0.13096787,0.08481104,0.058305934,0.046459172,0.04407164
UPDATE AL basin: HURRICANE IRENE CAT: 1 @ 03:00UTC | Loc: 37.3N -75.4W | Winds: 80mph | Moving: NNE @ 16mph | Pressure: 954mb,0.26751909777522087,25,32,62,31,55,0.07120494,0.060325988,0.055264466,0.040721707,0.040002
"HELP HURRICANE HARVEY VICTIMS. I am a small business, but want to do my part to help with the… https://t.co/TWQelf1DSr",0.26119259372353554,21,33,24,47,34,0.099605486,0.048384365,0.044760235,0.036166415,0.032276094
"Me included! MT@ABCNewsTravel: Airlines Brace for Hurricane Sandy: 100's of flight cancellations, http://t.co/nQNrDEsO #travel #explore",0.28436964377760887,16,24,53,54,47,0.08305341,0.067655295,0.053684644,0.043668948,0.036307346
"@AnnaleePardoe exactly I'm not up for the side of my house ending up down cyber, need that to keep me warm Sandy was a shit storm anyway:/",0.1672331839799881,0,56,55,45,32,0.03556589,0.034882385,0.033375897,0.033368226,0.030040786
Beach-goers won't let Arthur dampen plans: There were some concerns about Hurricane Arthur for shore-goers in... http://t.co/UlCL86TSwm,0.27436748519539833,32,22,55,34,25,0.07659823,0.059742324,0.05794452,0.04016856,0.03991385
@Rox598 I think it was cancelled because of Hurricane Sandy.,0.3496672250330448,22,27,34,5,32,0.083118245,0.078701325,0.07759915,0.059143063,0.05110544
“@ComplexMag: Hurricane Sandy could affect the start of the NBA season. http://t.co/3n9TdaaM” chill bitch dont play games,0.4623615890741348,38,51,1,0,56,0.25152293,0.058894876,0.054942623,0.048675478,0.048325684
Make the Most of Your Cell Phone During Hurricane Irene http://t.co/ONjqI7d via http://t.co/wXZsgwi,0.17252206429839134,33,53,20,0,54,0.04034032,0.038684845,0.0341908,0.030367067,0.028939033
Impact of Hurricane Harvey on Houston commercial real estate market https://t.co/THVc0i5EOZ #Granada Hills,0.29581212624907494,33,40,17,12,31,0.08482869,0.06809621,0.052322842,0.05022967,0.040334713
"“@ariannahuff: ""How Hurricane Sandy Downgraded the Election and Upgraded Our Barn-Raising Spirit"" http://t.co/hosuo4O2 #Sandy” Helping #47%",0.32224396988749504,13,33,40,0,53,0.123732135,0.077070974,0.044242926,0.040906508,0.036291428
Entergy Nuclear Facilities Continue Preparations for Hurricane Sandy http://t.co/kWbUJkkK via http://t.co/wLKen1Mx,0.27355062030255795,40,33,53,30,31,0.085766114,0.083435334,0.041537322,0.031850968,0.030960882
عندماااا ..........  !! يكون لك هدف معين !! لا تلتفت للمغرياااات.....,0.42152879387140274,44,11,57,21,48,0.1565314,0.083141826,0.076085284,0.05671019,0.0490601
Hurricane sandy is no joke!,0.4252954088151455,12,52,56,43,45,0.17995255,0.06695053,0.06647706,0.057582863,0.05433241
"Everyone was in a rush to get electric fans & airconditioners &ice cream today B4  the storm,hope they have generators #Arthur #poweroutage",0.24349074065685272,61,21,33,53,8,0.061367914,0.057951663,0.05753733,0.033810765,0.03282307
Red Cross trains volunteers to help out with Hurricane Sandy disaster relief - http://t.co/qzn2Ch1s #Cazenovia #NewYork,0.27047402039170265,33,40,53,32,21,0.10849988,0.063462734,0.03753319,0.031768348,0.02920987
"Taken during the storm Sandy.  @ 33 Keeney Ln, New London, CT http://t.co/vgojbAKb",0.22423550114035606,24,47,33,30,8,0.0587058,0.04659051,0.0431252,0.042533588,0.033280402
"Alert-Update: Tropical Storm - Jose, Advisory 5, WATCH, Max Winds 111kph/69mph, Gusts of 139kph/86mph https://t.co/jfnb4kszZD",0.3168274983763695,12,33,32,62,25,0.098341234,0.06113884,0.058559902,0.053714063,0.04507346
@ThijsEykelkamp nee idd,0.21228990331292152,54,53,34,50,0,0.044745214,0.043993957,0.042595122,0.04129889,0.03965672
Proof that God is a woman.  Tropical Storm Isaac Should Rival Hurricane Katrina http://t.co/wCxLe7PD -- Forbes (@Forbes),0.22251666337251663,11,24,31,54,50,0.05890742,0.0462206,0.04139651,0.038064636,0.037927497
Bahcelievler..,0.188919298350811,24,35,45,43,27,0.04873627,0.037240587,0.036563925,0.034356393,0.032022122
نسم علينا الهوا ♡♥♥♡,0.35092292726039886,48,11,44,24,57,0.09751867,0.081388615,0.065695934,0.0591107,0.04720901
Now I'm having technical difficulties. I blame Hurricane Sandy! 😜🌀⚡,0.39268405735492706,32,55,52,43,19,0.12955938,0.12031092,0.05098431,0.046812892,0.045016553
"Hurricane Matthew, you were not welcome, but at least you brought my best friend and her babies… https://t.co/XL4nZgAJMg",0.2436804585158825,47,8,61,24,18,0.054335102,0.052249976,0.051233955,0.04544626,0.040415164
#Hurricane #Sandy: Damages--Boardwalk #Collapse http://t.co/img3VnhH,0.2656400743871927,24,16,47,33,30,0.108446494,0.047140308,0.04473951,0.036013138,0.029300625
Aldine ISD departments team up to respond to Hurricane Harvey https://t.co/mqJo2DiOBK,0.2204714585095644,0,33,53,40,20,0.058306783,0.051798612,0.042223554,0.04016331,0.0279792
Hurricane jose moving slowly westward https://t.co/ke0t4DmFPE https://t.co/mDNT9mpnrG,0.24508331343531609,34,12,46,45,27,0.07905716,0.05098897,0.042849112,0.037310395,0.03487768
A la guerraaaaaaa!,0.3369036167860031,57,24,30,55,58,0.1354006,0.06473067,0.06304541,0.03772755,0.035999395
How to Prepare for Hurricane Irene http://t.co/eyEhxpx via http://t.co/UYKw7XN,0.24175990000367165,34,43,45,20,46,0.071246475,0.047643688,0.045352727,0.041779242,0.035737768
“@OnionSports: Lone Runner Mike Bloomberg Wins NYC Marathon | More Hurricane Sandy Coverage http://t.co/5o4yZ74P” #fb,0.413392998278141,33,40,6,31,53,0.22423473,0.05807863,0.048203845,0.044704247,0.038171545
Tweet #PatchRebuilds to Help Hurricane Sandy Survivors http://t.co/gkWu6aWX via http://t.co/aSWl4IHG,0.26586686819791794,24,30,33,53,63,0.065624334,0.057886314,0.054041293,0.04465742,0.043657508
@librarykris didn't recognise you either! + yes :) / @haikugirloz @sarahlibrarina @modoufox,0.33228959515690804,24,47,53,33,50,0.09359755,0.0625345,0.061254,0.059180122,0.055723418
Hurricane prep for #Sandy happening at Costco. (@ Costco Wholesale Club w/ 6 others) [pic]: http://t.co/BUYj2NKW,0.2803514786064625,33,24,31,63,47,0.074408874,0.054684665,0.054357294,0.052246585,0.04465406
"The 4pm updated position and forcast for Hurricane Harvey. 
Not a good scenario at all. https://t.co/qPlXTvsSVS",0.28932831436395645,22,32,25,55,43,0.07686178,0.056731094,0.055881653,0.05220521,0.047648583
"~~"" RT @rillyanawa: \(´▽`)/ °\(^▿^)/° RT @veeqhey: RETWEET LENO :p RT @rillyanawa: RETWEET @NessyLovato: Best couple ever ---> gendut dan",0.9369176654145122,24,16,47,8,53,0.5675974,0.21123733,0.1450958,0.0073808916,0.005606263
My prayers go out to the people of hurricane sandy.,0.7138145975768566,21,5,46,61,8,0.50810075,0.06503869,0.05004629,0.045856565,0.044772305
"Waiting for hurricane Sandy , coming in some hours :S",0.19658692181110382,14,41,42,62,44,0.04513605,0.04297223,0.04047783,0.038296778,0.029704034
2 weeks later: The lingering effects of Hurricane Sandy in the East Village http://t.co/UKNwIRgK via http://t.co/3jhrKFZz,0.29097799956798553,12,52,62,43,20,0.08449887,0.06843376,0.053775683,0.044326033,0.039943654
Все сегодня отходят после хэлоуина или кто-то тусит?),0.782972939312458,21,60,63,34,11,0.2802699,0.2796712,0.106557205,0.07003118,0.04644347
Tropical Storm #Isaac is near 16.2N 67.8W and is moving WNW at 14 mph. http://t.co/sUw6YrDG,0.25736944004893303,12,32,25,62,33,0.103373855,0.042866237,0.038519166,0.036838513,0.035771668
I too would rather sit out in the remnants of hurricane Isaac than sit  under that umb  @ Des Arc ball field http://t.co/6j3XJSYM,0.24757681414484978,39,25,52,19,43,0.06840734,0.049485814,0.04869451,0.046639293,0.034349855
@bavariayachtsus Getting the ladies ready to weather the storm #Sandy http://t.co/b1E9sf6f,0.3480893559753895,31,33,50,54,53,0.09148843,0.08081312,0.07984874,0.05547487,0.040464204
@frztheindustry @gelelindustrie For tdot #Sandy is a super storm but it's still coming. Maybe we can redirect it to the Tobacco Industry?,0.48027899116277695,50,54,33,53,62,0.16987373,0.101488866,0.072859205,0.07263837,0.06341882
Single fin activity during Hurricane Arthur at Ocean Isle. I get these 20 minute smoke breaks every so… http://t.co/oxccsAsyNx,0.17968200147151947,19,20,62,31,25,0.045206115,0.03931484,0.032721616,0.032182686,0.030256744
..stay safe for those on east coast during hurricane sandy <3,0.35355181992053986,21,30,61,33,8,0.18942502,0.06344817,0.046460725,0.02814914,0.026068766
Bethpage Federal Credit Union Supports United Way and American Red Cross Hurricane Sandy Re http://t.co/TGDXQgwU via http://t.co/A8ZXxywH,0.40870657563209534,40,33,24,47,53,0.15694806,0.12081986,0.05384819,0.0387942,0.038296267
Looks like my flight home is not affected by the hurricane #sandy,0.2072317972779274,33,20,62,31,53,0.06383515,0.039468255,0.035394274,0.034858547,0.03367557
"Storm edge, blue skies ahead in SC #sandy http://t.co/sVQSS1kU",0.31011179834604263,61,11,48,62,63,0.15656345,0.04800738,0.038530305,0.03451724,0.032493427
"Not doing my hair today and calling my Halloween costume ""Hurricane Sandy"".. Or I'm ok with the Grease Pink Lady ""Sandy"" if there's a repeat",0.33694761991500854,26,56,19,25,20,0.11099209,0.09763538,0.046696078,0.042456996,0.039167076
Hurricane Matthew strengthens to powerful Category 5 with 160 mph winds https://t.co/eEIB4PINvs,0.29895906522870064,12,40,57,33,21,0.08077867,0.06675554,0.05769204,0.047549702,0.04618311
Eye of Hurricane #Matthew continuing northward just off of the coast of Georgia https://t.co/PRkLzG3vEb https://t.co/tq51nHU5dC,0.2344941794872284,41,12,34,33,11,0.066797495,0.06090898,0.040056325,0.036067754,0.030663624
“@AdrianVsStackz: Hurricane Irene Gonna Shut Down Alot Of Shit!!”<--Why'd you have to ruin my hopes and dreams of that not happening?! Lol,0.25837739184498787,55,29,34,43,52,0.06053913,0.05616486,0.04795001,0.04775614,0.04596725
"Red Cross Urges Immediate Blood, Platelet Donations Following Hurricane Irene http://t.co/I94h5DI via http://t.co/UMazPLS",0.24232981726527214,32,24,55,47,33,0.06841998,0.05251833,0.045723155,0.039695453,0.0359729
@JamRose05 favorite mo yan ate? :D,0.5228511169552803,24,47,53,33,16,0.219686,0.10541826,0.07165954,0.06942153,0.056665786
"""@astro_reid: Hurricane #Arthur has grown an eye since we last met. http://t.co/yfsBR6tYYP"" yikes. B careful, NC folks!",0.4713292643427849,12,62,41,10,22,0.1823301,0.12685014,0.072209686,0.046069868,0.043869466
I'm at Frankenstorm Apocalypse - Hurricane Sandy w/ @paulcubbybryant http://t.co/cLnibxMW,0.2321031577885151,51,31,42,30,11,0.056776524,0.054274123,0.04174362,0.041221466,0.038087424
"Si yo fuera mosquito,¿dónde tu quieres que te muerda?",0.3197973445057869,11,55,48,58,32,0.1175322,0.06629216,0.04794342,0.047603235,0.04042633
"So far, in #nova, #Irene is just cold rain. Cool hurricane, guys.",0.3024848401546478,33,11,31,30,6,0.0966076,0.075980395,0.04451446,0.044323847,0.041058537
Will the hurricane #Sandy blow the #USElection results right up #Obama's path ? Playing commander in chief could prove his saviour #Politics,0.3010079525411129,33,21,50,58,41,0.08981026,0.078562,0.054660693,0.039576087,0.038398914
@GarrettNBCNews luckily there was no Superstorm Sandy over Boston,0.2928024157881737,50,20,54,33,62,0.10126924,0.058506258,0.052596476,0.042169128,0.038261317
Shoutout to @dwyaneWade for donating his entire game check $210K to the hurricane Sandy relief fund!! #salute 👌,0.5529997050762177,17,13,40,21,33,0.13623317,0.124906875,0.112457246,0.106380336,0.07302208
State Closing Parks Ahead of Hurricane Sandy http://t.co/RHelvUrw via http://t.co/mv7yaZTi,0.24604177474975586,12,62,33,34,53,0.08517214,0.04317496,0.04253406,0.042296946,0.03286367
"While hurricane sandy here, I got some #Roti& Curry for her ass",0.3360125161707401,36,44,9,54,31,0.123363264,0.074292056,0.047616236,0.045426738,0.045314223
North Jersey food banks another victim of Hurricane Sandy - http://t.co/lk45LDXP #LittleFerry #NewJersey,0.21828383393585682,39,32,52,55,44,0.05866911,0.04626603,0.041419957,0.04139814,0.030530596
Continuous updates on Superstorm Sandy's impact on Northeast Ohio. - http://t.co/RXT4luIO #Amherst #Ohio,0.3467562906444073,33,40,57,58,30,0.111866854,0.08455674,0.06792922,0.043903917,0.038499553
First drive through/into Delaware in 3 days and it looks like hurricane Irene did basically nothing. I'm really happy about that.,0.39844850078225136,7,20,53,33,10,0.09346124,0.09084459,0.08478351,0.07731724,0.05204193
"In my fairy wings so I can fly away from this storm. Bring it on, Sandy.",0.353324256837368,63,58,57,11,44,0.12018551,0.06978398,0.05721396,0.057128824,0.049011987
"You heard it first here —> RT @TherealRyu: I just won an Oscar, and I got a Grammy, first guy to rhyme about hurricane #Sandy",0.5051642395555973,16,24,47,41,31,0.32516354,0.07003414,0.037313554,0.037021376,0.035631627
"1NYP flooded in manhattan. 
#sandy #hurricanesandy #hurricane #aftermath @ 1 New York Plaza - Command Center http://t.co/JnhXagtW",0.23600071668624878,33,57,31,53,54,0.06605455,0.049123637,0.04648403,0.039676692,0.034661803
"After sandy, snow storm and my injury getting worse. I think it's time to go into a detox this weekend. Who wants to join?",0.3179871402680874,39,62,10,52,33,0.121960215,0.073787436,0.046574675,0.038204256,0.037460558
"They renamed hurricane Sandy ""Frankenstorm"" because Sandy would be a more relevant name for a sandstorm.  🌊🌀🎃",0.19100775569677353,19,12,25,22,50,0.047602247,0.037610713,0.037157398,0.036286384,0.032351013
I live in .the.clouds.bring it on hurricane.sandy hahaha,0.2621722146868706,11,53,54,24,31,0.07322192,0.054811038,0.046483282,0.044582926,0.043073047
RT @acyair:... #ACY is currently closed due to Hurricane Sandy. http://t.co/PffSNcgz We hope everyone stays safe throughout the storm!,0.3562039025127888,21,34,16,33,24,0.14039463,0.07777941,0.049059346,0.047688384,0.041282132
Washed up #surf #sandy #hurricane #hurricanesandy #fl #canaveralnationalse @ Shark Bite Capital Of The World http://t.co/KcIs0u9k,0.17672847770154476,39,33,55,53,34,0.041679256,0.041038606,0.033730656,0.030194703,0.030085256
"Hurricane Sandy: Power outages and downed trees keep officials, National Grid busy - http://t.co/2oKo7pkO #Adams #Massachusetts",0.2754419967532158,57,33,58,31,40,0.09789274,0.06911084,0.03979059,0.03469626,0.03395157
Hurricane sandy + red wine+ karaoke/ family= gittin weird up in err,0.322689451277256,12,39,52,62,28,0.09270201,0.069691576,0.060812652,0.0580386,0.041444615
I cannot even describe how happy you make me. Although Hurricane Matthew may have messed up some… https://t.co/LniudB7B6z,0.2143670991063118,34,3,53,46,47,0.055071365,0.047995824,0.039606467,0.039033223,0.03266022
"""@weatherchannel: NOW on The Weather Channe: @JimCantore getting hammered by 65-70mph gusts Hurricane #Arthur."" hehe getting hammered",0.41114143654704094,54,50,33,31,49,0.13422015,0.082345985,0.07025385,0.06689221,0.057429243
..HURRICANE ISAAC  hitting Louisiana..hope it doesn't have that Katrina affect...they just got everything back right down there...,0.3111090213060379,12,41,22,21,62,0.12036155,0.053064052,0.047405552,0.04673652,0.043541346
Help Hurricane Sandy Victims and Long Islanders in Need Enjoy Holiday Feasts http://t.co/oviVFJwk via http://t.co/qqDIsizu,0.4535084757953882,21,34,27,47,5,0.2009866,0.13472259,0.05456421,0.03246083,0.030774249
The hurricane survival craze has begun! HAHAHA! #Sandy  @ Super G http://t.co/Wv1S9jRE,0.32666344195604324,33,53,57,58,40,0.07601766,0.07126088,0.06334651,0.060912296,0.055126093
Time to drink! (@ Hurricane Irene 2011 Baltimore w/ @kdforte) http://t.co/EF8FKme,0.284015778452158,54,33,53,31,10,0.0750857,0.063347846,0.053174734,0.04725941,0.04514809
"""@ItsIanAmazin: You'll never find the right person if you don't let go of the wrong one.""",0.6475659012794495,17,13,40,6,33,0.18142366,0.16895992,0.15374297,0.09733907,0.04610028
"I'm at Hurricane Irene Projected Path (Moving Target, Washington) w/ 384 others http://t.co/evZI5VX",0.2144320197403431,53,62,10,7,16,0.049367417,0.047300175,0.04256034,0.038005907,0.037198182
Tropical storm Isaac soon to be a category 1 hurricane. Be prepared.. I'm not for sure if we're getting it.. But omg.. Florida's gonna get,0.2609022259712219,58,42,44,62,12,0.07566582,0.0520927,0.046488788,0.043643914,0.043011006
@kimpuyfeliciano Follow me back.,0.2059086561203003,55,32,16,37,24,0.053259414,0.043732066,0.04023226,0.034809723,0.033875193
Target already looks like they were hit by hurricane Isaac.   @ Target http://t.co/Iwk1zhtj,0.26735931634902954,12,0,25,19,20,0.10099367,0.050816685,0.04433437,0.03724943,0.03396516
"Hurricane Michael has formed in the Gulf of Mexico, west of Cuba, and could impact New England by later in the week. @ Storm Tracker Weather Center https://t.co/iMsREOms59",0.2538793496787548,22,12,32,33,62,0.053054594,0.05278013,0.05097766,0.050867744,0.046199225
House rewlz,0.2639080807566643,48,24,11,17,6,0.07129447,0.06250122,0.053941447,0.040081695,0.036089245
Everybody's nobody,0.5837570689618587,56,11,13,48,14,0.20487855,0.14595693,0.102100044,0.081482075,0.049339462
@shsh7600 언제부터 혈세 걱정을 했을까 그리걱정되었으면 22조사업부터 차단하시지 이무삭한 후보야,0.4922037906944752,24,21,54,20,47,0.19304316,0.13318214,0.06259814,0.052687526,0.05069283
"excellent editorial  @nytimes: Critic’s Notebook: Changes Needed After Hurricane Sandy Include Politics http://t.co/KwidZB0y""",0.5635025501251221,40,33,16,53,17,0.25487658,0.18485387,0.048504837,0.037994064,0.0372732
"🚨Hurricane Michael donations this Saturday, from 11am-1pm at the Tulsa Welding School Open House at 3500 Southside Blvd. Items being requested are:
 
Water, Toilet paper, Baby wipes,… https://t.co/x6fEPT5Qb1",0.27983634546399117,47,8,61,7,24,0.06767516,0.057950255,0.05271635,0.051709156,0.049785428
Tropical Storm #Arthur is near 28.4N 79.1W and is moving N at 5 mph. http://t.co/ltH2faOMQn,0.23430235683918,12,25,62,32,31,0.089722596,0.03851563,0.03639584,0.03563309,0.0340352
Why can't hurricane sandy knock our school down?,0.32434382662177086,55,29,32,27,2,0.07892459,0.06868082,0.061217908,0.05816293,0.057357576
Soo tired 😴,0.6948465406894684,14,27,43,35,29,0.46915817,0.06189813,0.061696496,0.053251788,0.048841953
Hurricane 8pm to 6am btw fuck Isaac,0.3143519349396229,42,19,30,14,58,0.10422274,0.057832558,0.05227797,0.05161162,0.048407048
