Text,Top5%,Emoji_1,Emoji_2,Emoji_3,Emoji_4,Emoji_5,Pct_1,Pct_2,Pct_3,Pct_4,Pct_5
"The Latest Satellite Image of Tropical Storm Michael. https://t.co/vXGDpJioPs 
God Bless, Peace, Love and Knowledge!
Please Visit and Shop the Store at Battleship Marine!
https://t.co/I8Aje6nfph https://t.co/y5Jv4vvChK",0.35904451087117195,21,30,47,24,8,0.11258738,0.07645295,0.06589767,0.05733053,0.04677598
"#hurricane #irene - no watches or warnings in effect for Bradford County PA. Subject to change, of course.",0.2050129808485508,19,43,33,58,45,0.043559957,0.043496054,0.042320307,0.039829407,0.035807256
#Hurricane #Sandy October 2012: #Trees Turned Upside Down http://t.co/cS1I5tUq,0.17813724651932716,12,34,46,33,27,0.039253242,0.03838059,0.037917465,0.03260791,0.02997804
Waiting for.the hurricane #Sandy,0.34788542054593563,11,48,24,47,6,0.13051385,0.10571463,0.04869152,0.035694078,0.02727135
"So, it's hurricane weekend, what are people doing? #hurricane #sandy",0.24916107952594757,12,62,11,28,61,0.092818275,0.045716684,0.037627324,0.03670062,0.036298174
Miami Fri 9/30/16 3:15am 86°f All eyes on hurricane Matthew roaming to the south. Good morning! Stay safe. Stay dry! Have a good day!,0.32659435272216797,33,30,31,7,50,0.14148624,0.055728115,0.045907866,0.041834723,0.041637406
🌊 #inktober @ Lake Bled https://t.co/UpLVJLUBnA,0.18463585525751114,24,30,11,33,31,0.044715386,0.036457468,0.036111247,0.03409091,0.033260845
Okay.....good.....,0.27645512111485004,40,33,6,41,57,0.12000994,0.050635803,0.042449072,0.033757042,0.029603267
Oh my goodness being at this Storm game without Isaac is like missing part of my heart. I feel so guilty :( glad we're winning though!,0.386437326669693,46,8,47,61,59,0.11331887,0.07403344,0.07077749,0.0703581,0.05794943
#Isaac is now officially a deadly storm; AP reports at least 3 lives were lost in Haiti (via @breakingweather),0.2362934947013855,34,51,52,42,12,0.056993574,0.046477612,0.044828225,0.044738296,0.043255787
"Due to Hurricane Florence, DWT has cancelled its trip to William & Mary this weekend. Instead, the Big Green will host @officialhwt in the Dartmouth Shootout, a special 2-day tournament on… https://t.co/bRo3dEQAr8",0.3702390007674694,33,31,50,53,40,0.16725893,0.06540236,0.056264337,0.040819664,0.040493708
I Fall To Quick & Easy ! Still Young & Dumb <<<<< But Ain't Gone Let Nobody Play Me Like Im Bald Head ! CTFU,0.4588184468448162,56,13,38,54,0,0.19791344,0.10574579,0.062382687,0.053779226,0.038997304
"#tropicalstorm #michael making his way through the #gulfofmexico. What a great name!
#storm #caribbean #yucatan #mexico @ The University of the West Indies, Mona https://t.co/tyaLED1b40",0.5079486146569252,40,33,57,58,17,0.2119048,0.13312878,0.07510916,0.04947215,0.038333733
Better get my swimming trunks on,0.2641616426408291,31,9,58,57,44,0.07931531,0.057018023,0.043129783,0.042692132,0.042006392
I <3 NYPD “@TUSK81: Tears. Fireman saving dog caught in hurricane: http://t.co/R9hdjUNf (Photo via @PrincessGwenie1) #Sandy”,0.42877907305955887,24,34,47,16,53,0.14714777,0.1181691,0.078398496,0.056070052,0.028993651
"Hurricane Patricia, aiming for Mexico, called strongest ever in Western hemisphere: Hurricane Patricia headed… https://t.co/qPiHR6frcO",0.29996291920542717,57,33,31,42,12,0.15387188,0.04359073,0.040312633,0.031149382,0.031038297
Ya empezo la odisea. (@ Policía Nacional de Panamá) http://t.co/104S2jd2,0.2633330821990967,24,11,57,40,48,0.07942239,0.06329876,0.043410517,0.039908063,0.03729335
Hurricane Irene appears to have taken a wrong turning and ended up in #Bath.,0.3128955662250519,12,25,19,20,62,0.09431165,0.07431878,0.0511582,0.046710882,0.046396054
"""@twc_hurricane #Arthur's wind speeds reach 100 mph, now a Category 2 #hurricane. #Arthur moving NNE at 15 mph. http://t.co/BJYBFqyAba",0.31431063637137413,32,12,33,55,62,0.08239215,0.06725068,0.06524652,0.059418645,0.040002644
"Flipping between Hurricane Isaac news and the Republican National Convention. 
#merica!
#RomneyRyan2012",0.29990746080875397,61,40,33,58,17,0.093193725,0.0702851,0.05631235,0.040186636,0.039929654
@LiamValleys they look like girls bracelet!!,0.2970637921243906,4,53,12,3,10,0.13079004,0.057008978,0.046726618,0.032060247,0.03047791
Collection of doantions for Victims of Hurricane Sandy at all locations of Mosaic Salon & S http://t.co/HaZhRyUX via http://t.co/5PG0bWpY,0.19923534244298935,33,44,51,12,31,0.057878055,0.043671172,0.03347142,0.03293354,0.031281155
"how do u live thru Katrina, get evacuation warnings for hurricane Isaac and still say ""nah.....I think I'm just gonna stay home"" ????",0.2642304077744484,25,19,22,55,32,0.06261101,0.059447438,0.050827898,0.047108296,0.044235762
"Karena hati tak perlu memilih, ia selalu tau kemana harus berlabuh~ @… https://t.co/HNvUinqZE1",0.19147613644599915,34,20,35,43,15,0.047144372,0.03788705,0.03636094,0.036332402,0.03375137
Dogs Lost in the Heart of Hurricane Sandy http://t.co/VWlX59FM via http://t.co/lkRt4QBp,0.5558369569480419,46,34,27,5,45,0.2557182,0.1857902,0.0445916,0.034905016,0.034831945
Blessings out to my brother out in jersey who just survived hurricane  sandy and is expecting snow and 60mph winds tomorrow.,0.5998240560293198,21,17,61,40,33,0.378517,0.12300741,0.036511227,0.035688028,0.02610039
Disaster Unemployment Assistance Expanded to All New Jersey Counties Due to Hurricane Sandy http://t.co/7u3wbGCB via http://t.co/PJCajdk6,0.27075599133968353,32,55,52,62,43,0.07820944,0.060080778,0.04785611,0.04339442,0.041215245
Monmouth University to Close Oct. 29 and 30 Due to Threat of Hurricane Sandy http://t.co/p7jD9r9R via http://t.co/SgfY2El9,0.21012825146317482,12,32,62,55,42,0.049640197,0.04752333,0.040685907,0.03741792,0.034860898
Hurricane sandy in Taylor's. http://t.co/RwxAYOsz,0.23152779787778854,12,30,33,31,6,0.06988404,0.04710879,0.045731127,0.035222966,0.033580873
"Praying for Haiti, Cuba and other Caribbean countries devastated by hurricane Matthew. This… https://t.co/qsia8F1xzL",0.6600686348974705,21,46,34,5,27,0.32450145,0.12617077,0.10588845,0.055550758,0.047957204
"I'm at Frankenstorm Apocalypse - Hurricane Sandy (New York, NY) w/ 2892 others http://t.co/m6P4XR4",0.23324823752045631,31,63,30,53,24,0.054886255,0.05262488,0.044285722,0.042881433,0.038569946
"new @CobraStarship single & itunes session, new @HawthorneHgts HATE, new @wecameasromans song #NewMusic :)",0.6722609177231789,48,24,11,47,33,0.2066733,0.15822877,0.15348528,0.103033595,0.050839975
Hurricane Harvey Donations: Houston Astros: $4M Houston Rockets: $4M Houston Texans: $1M Floyd Mayweather: $200M… https://t.co/kwUs1FAwq0,0.4356415830552578,44,31,57,41,13,0.1262068,0.09532439,0.08289427,0.079832084,0.051384035
A victim of Hurricane Sandy.  Sadness @ Mi Casa http://t.co/f1uC82vC,0.5562392957508564,34,46,27,5,35,0.22629146,0.1396743,0.08314265,0.05677499,0.050355885
Happy Halloween & a safe Hurricane Sandy night to all! (@ #Frankenstorm Toronto w/ @leoraheilbronn @salamahoy) http://t.co/rWJzeNHn,0.6384993065148592,51,44,63,47,59,0.46215668,0.06885667,0.050976228,0.029615007,0.026894717
Here's the latest 5pm advisory: Hurricane Matthew remains a Cat 4 storm with increased winds of 150 mph… https://t.co/kqG0ikZ5tL,0.32797611877322197,12,32,62,55,33,0.09609926,0.075068235,0.060999405,0.048421517,0.047387704
"Act, partner aku xtaw yg aku lapar..hhahaa sbb aku pndi belakon...dpn senior kena blakon..",0.4165147729218006,34,45,35,43,27,0.124122694,0.086095415,0.082032874,0.07966213,0.04460166
"I'm at Frankenstorm Apocalypse - Hurricane Sandy (New York, NY) w/ 2816 others http://t.co/xVsWTAzG",0.23324823752045631,31,63,30,53,24,0.054886255,0.05262488,0.044285722,0.042881433,0.038569946
"RT @AP: In wake of #Superstorm #Sandy, Romney faces scrutiny for past comments on disaster relief: http://t.co/07kN1WmT #2012election",0.240148663520813,41,16,24,12,17,0.06592905,0.048853837,0.045690004,0.040301137,0.03937464
"“@Yankees: The #Yankees will donate $500,000 to help the tri-state area recover from Hurricane Sandy.” #yankeeuniverse",0.3206835314631462,33,40,21,17,61,0.10146715,0.083756536,0.047071036,0.046299715,0.042089097
Ironic #NBC is running #ThePerfectStorm Against the undefeated #Falcons vs #Saints game!  If we loose it will be a perfect storm!  #Sandy,0.2908015362918377,57,33,61,12,62,0.07571294,0.06842684,0.056577854,0.047674164,0.042409737
"All Antigua closed. Tropical Storm Isaac only 
a few hours away... 🌀 (at Home @ Jolly Beach) [pic] — http://t.co/Snb5FZVr",0.19822533428668976,31,54,50,11,34,0.053988762,0.04400268,0.034242354,0.032996655,0.032994885
I don't care if this hurricane Arthur shit delays us till 2 in the morning. I wanna get to the final four so baaaad😩⚾️ #7seed #2wins,0.4144203644245863,32,55,37,58,29,0.1360615,0.12983792,0.0691982,0.048606973,0.030715773
"I know I have family & friends concerned about me with Hurricane Sandy hitting the east coast. 
... (at Washingto,DC) — http://t.co/eFlhkHUj",0.18541821837425232,31,30,26,20,54,0.042961843,0.042032063,0.03694313,0.032378893,0.031102289
Hurricane Sandy: live http://t.co/nlN08Rex #USAnews,0.27458734437823296,48,11,24,33,30,0.06971542,0.06586091,0.051258285,0.044001196,0.043751534
"I'm at Hurricane Irene (Moving Target, Washington) w/ 329 others http://t.co/JlmEHKC",0.20186129212379456,62,20,12,10,53,0.049387503,0.041934274,0.03848892,0.038180374,0.03387022
#أخبار #اخبار فيديو: استقاله وزير النقل ورئيس هيئة السكك الحديدية http://t.co/Ty4DHk0J,0.42784348875284195,48,11,21,57,55,0.15675358,0.10145247,0.08214445,0.047397148,0.04009584
Tweet #PatchRebuilds to Help Hurricane Sandy Survivors http://t.co/AYPf0cOH via http://t.co/1dtx87uV,0.26586681231856346,24,30,33,53,63,0.06562432,0.057886302,0.054041285,0.04465741,0.043657497
"I'm at Rialto (Av. Ministro Ivan Lins, 314, Rio de Janeiro) http://t.co/DGnnsGQ",0.24980976805090904,24,47,30,31,53,0.08312478,0.045389872,0.04137097,0.041086696,0.03883745
"#HelpHOUSTON👍
#HelpSouthTEXAS🌐 
#GOD1stAndAllThingsArePossible🙏 ""#Hurricane #Harvey will likely… https://t.co/fKmp32UjyM",0.21000352129340172,53,54,50,57,33,0.045371726,0.044493116,0.042268276,0.03911567,0.03875473
Tu n'as que ce que tu mérites,0.657356271520257,11,48,24,9,58,0.35529205,0.22556627,0.03830706,0.019660125,0.018530767
Hurricane Sandy rips through Mercer County - http://t.co/1f0Ca1yT #Somerville #NewJersey,0.21749410592019558,12,33,31,11,61,0.07101374,0.048367247,0.034345318,0.033897392,0.029870408
"What kind of a name is Sandy anyway...it's a hurricane, not a dug. It should be called Windy or something",0.4898110181093216,55,32,22,25,19,0.11081477,0.108348,0.09583046,0.09294722,0.08187056
"“@maryjblige: Hurricane Sandy is serious but this to shall pass. Stay strong people!”<--You do the same MJB, we're only half way through.",0.4285597428679466,57,21,33,58,47,0.18712284,0.11001192,0.054837912,0.044104747,0.032482326
powering through hurricane Arthur with @kramkels 🍷 http://t.co/y0b5yzLzhK,0.40103568881750107,57,58,33,40,30,0.18838617,0.07064935,0.0683001,0.040051706,0.033648364
The storm is a coming! #Sandy #Frankenstorm  @ Pier 84 http://t.co/FSyXlLYj,0.27474959939718246,10,62,12,61,33,0.062373884,0.062264003,0.05180262,0.050109047,0.048200045
@JoeRedPeps perfect! Man I was looking for a weatherman I can rely on for up to date info! #Sandy #Hurricane #HurricaneSandy #weather #puppy,0.35228463634848595,33,50,53,54,6,0.1379054,0.075823106,0.059575066,0.042087827,0.036893234
Hurricane Sandy brought us a present & left it in our back yard. http://t.co/2KilUcln,0.2646428197622299,12,19,25,42,20,0.09243838,0.050599698,0.04535578,0.043179724,0.03306924
Some where out there is my favorite @chris_gaither  hat Just lost it! #sandy #hurricane @ Dane Street Beach http://t.co/WnByXa2A,0.2835412584245205,34,32,46,55,29,0.07589169,0.059670065,0.056856513,0.055100176,0.036022816
😱It's been scary hearing the news of Hurricane Matthew hitting… https://t.co/7kzS731zgt,0.39665838330984116,12,34,52,43,45,0.12967089,0.08311509,0.075698465,0.055098776,0.05307516
"🚨🚨GET READY NOW🚨🚨
It's too early to determine what impacts #IRMA might have.  Have a hurricane… https://t.co/zyx0I0x9F0",0.20459970086812973,33,54,11,31,53,0.047311775,0.046995074,0.03828466,0.03755682,0.034451373
I am so done with Hurricane Harvey. I'm done with the rain. I m done with it all.… https://t.co/cQMKBKqIgW,0.5638735070824623,32,55,56,37,38,0.1788897,0.13423638,0.10449102,0.082228854,0.06402755
#Sandy can take our MTA but not our donuts! #bk #hurricane  @ Dough http://t.co/lnpf16jy,0.28585323318839073,55,32,34,37,46,0.08777584,0.07436624,0.04717514,0.04423259,0.032303423
"HURRICANE FLORENCE ALERT!

(PLEASE SHARE)

Winchester Raceway Park , just off the square in Winchester, TN is Opening as a refuge from Hurricane Florence. 

Anyone with a valid NC, SC, VA,… https://t.co/fqlk1ffpe7",0.2666992172598839,33,50,54,44,21,0.07508693,0.05708129,0.046728846,0.046287358,0.041514795
And hurricane Isaac ends the beach day early than planned. #sadness #stopraining,0.21279334649443626,31,33,12,17,40,0.070922874,0.046328582,0.034254313,0.031000847,0.030286731
@Timeflies please put a recording of it up after. i have a meeting to plann a fundraiser for hurricane sandy victims at 930! #priorities,0.316244475543499,33,54,50,32,21,0.09723947,0.0617863,0.05472238,0.05372355,0.04877277
"BYE, ARTHUR: Storm Moving On, No Issue For South Florida http://t.co/5HIZTcCGMp",0.2969670742750168,30,31,33,40,10,0.09682003,0.057155278,0.0559494,0.044119596,0.042922772
"I'm at Hurricane Sandy (Warwick, RI) w/ 24 others http://t.co/8JPP0IYq",0.18672896176576614,24,54,16,53,31,0.042400386,0.039522793,0.036205992,0.034361042,0.03423875
Yep I told you...“@Y7News: Super storm #Sandy could help #Obama http://t.co/TlhR8Gdr”,0.2306249961256981,16,33,53,54,10,0.09470258,0.037691854,0.03486609,0.03184641,0.03151806
Cleo catching breakfast FTW. Hurricane Florence rations still in effect. #susiewrites #cleoandsailor #sailorandcleo #dog #dogs #dogsofinstagram #newfoundland #newf #adoptdontshop… https://t.co/DqLlbo9YYN,0.3261100836098194,33,57,58,31,30,0.11393589,0.06699935,0.054484732,0.04760419,0.04308592
Lunch and gossip time with some favorites @suziemoldavon @NRich14,0.3669712394475937,26,6,49,59,16,0.11676546,0.07530807,0.07236273,0.057961166,0.044573814
Hopes @pcvroom can drive faster than Hurricane #Irene and makes it home from Myrtle Beach safely!,0.43629542365670204,21,33,10,17,53,0.22899522,0.05952655,0.0566287,0.05184859,0.039296363
Looks like I left new Jersey just in time to miss hurricane sandy !,0.41388893127441406,34,5,27,46,22,0.15494797,0.08863372,0.06759432,0.0619747,0.04073822
#ihave #Residential #Flat #Forrent http://t.co/3zjcfBc3 #2Bedroom #Apartment #Belapur #NaviMumbai #PropertyWala,0.2079748436808586,11,57,21,48,33,0.055832315,0.051502,0.038796097,0.032109436,0.029734995
"⒍ Untagged Now
⒎ Hurricane Matthew
⒏ #VendrediLecture
⒐ Karine Le Marchand
⒑ Anne Pingeot

2016/10/7 06:10 CEST https://t.co/iQIQ3mQZoL",0.3312270902097225,24,63,44,31,57,0.0862333,0.082357705,0.07801607,0.04496649,0.03965352
"#CYCLONE Alert-Update: Hurricane - Irma, Advisory 23, WARNING, Max Winds 222kph/138mph, Gusts of 269kph/167mph https://t.co/VPsluF8JZq",0.28840240463614464,32,55,12,33,62,0.08502477,0.055590983,0.05405288,0.04846552,0.045268256
I text @m_foltzz7's house all the time.. 😡,0.34315231814980507,12,28,26,49,0,0.15047742,0.05814164,0.050696213,0.044592194,0.039244846
Mercer County GOP to Host Hurricane Irene Relief Fundraiser Sept. 4 http://t.co/sv43Dk4 via http://t.co/CLU0laI,0.21653250604867935,33,32,53,12,62,0.05622677,0.04164302,0.039947808,0.03948627,0.039228637
"I'm at Frankenstorm Apocalypse -Hurricane Sandy (Suffern, NY) w/ 27 others http://t.co/OPdgrmvE",0.22310281544923782,31,24,63,30,53,0.049712975,0.046393123,0.044729855,0.041927423,0.04033944
They talk about hurricane sandy mxm....shit we had zakaria on saturday !!! http://t.co/WqgGrUPN,0.3507342264056206,32,55,34,37,19,0.084980205,0.079408,0.070789635,0.06393979,0.0516166
"#Florida #home standing tall after Hurricane Michael. It's a great deal! 5,888 sq ft,7bd/6ba,1story,#golf course frontage double lot,near #beach
#vacation #vacationhome #vacationhouse… https://t.co/7FiV80ZO0R",0.3542238585650921,33,31,53,63,57,0.10579953,0.08690519,0.06382294,0.049123663,0.048572533
"Despite $50B In Damages, Hurricane Sandy Will Be Good For The Economy, Goldman Says http://t.co/kYuLoa6D",0.2501843273639679,33,53,31,50,54,0.08561571,0.046551365,0.040430684,0.04005219,0.03753438
Diocese of Metuchen assists victims of Hurricane Sandy http://t.co/hCs5cQHZ via http://t.co/5AIoophB,0.2158720027655363,33,40,12,34,53,0.06205446,0.046220187,0.04205889,0.03446408,0.031074388
LIST: Several Supermarkets Open in Suffolk County Following Hurricane Sandy http://t.co/BjhJtaZr via http://t.co/v5qY5hC8,0.24097206816077232,33,54,31,53,32,0.06566759,0.052412555,0.042822156,0.040561374,0.03950839
"Hurricane Sandy: John Legend, Rita Ora, Grimes, The xx Cancel Northeast Concerts - http://t.co/kApzRZBv #Chester #NewYork",0.27048201858997345,11,63,51,17,48,0.096343726,0.05494154,0.040244006,0.039581925,0.039370824
Gristedes sparing no expense on storm preparation #Sandy #frankenstorm  @ Gristedes Supermarkets http://t.co/kG18hPua,0.2886069416999817,57,44,33,58,31,0.08223362,0.06439507,0.057066627,0.044391766,0.040519856
Baby shower with babes 😍😘😘💙 @_AlexxBxtchh http://t.co/GTCsG2Qz,0.3693668842315674,61,23,59,18,8,0.099933565,0.09795656,0.06582787,0.05332176,0.05232713
48,0.29400409385561943,24,47,18,46,60,0.123018794,0.045245256,0.044104453,0.042052265,0.039583325
"We're getting winds here in Toledo,Ohio from Sandy. I hope my favorite place NYC will make it through this storm. I #Sandy",0.28754741698503494,21,61,8,62,52,0.0813101,0.061163437,0.05884056,0.04500016,0.04123316
"Sisi, pero qué caloooor...",0.19417922757565975,58,57,24,46,34,0.050540578,0.050490517,0.03793078,0.028323786,0.026893567
My heart goes out for those who are affected by hurricane #Sandy,0.6363593712449074,46,21,61,8,47,0.21631852,0.15345924,0.11224312,0.07778079,0.0765577
U.S. experts fear Hurricane Sandy could do more damage than Irene http://t.co/3JPsRwdI #Answers,0.21787532418966293,32,55,44,62,58,0.056069907,0.04524853,0.043640412,0.036700808,0.036215667
Matthew is having a break from reality,0.4097358472645283,46,45,34,35,5,0.15734361,0.07065075,0.06844961,0.06525075,0.04804113
Go to: https://t.co/Nmy96QXH0p and here's the direct link to Hurricane Matthew info:… https://t.co/07LGccfybc,0.33981724083423615,63,33,30,31,57,0.13321236,0.066939294,0.058501784,0.04175144,0.039412364
"“@LukesLobster: Nothing better than a $10 lobster roll...it's a night of ME (lobster) .... (Hurricane) Irene"" #TWOareBETTERthanONE !!",0.35272669047117233,36,4,17,33,54,0.17036389,0.050593153,0.050553303,0.042755917,0.03846043
It's pretty cool that Irene is gonna follow me home. The hurricane will make its way here as well.,0.28716569021344185,33,31,7,6,15,0.08175391,0.06679971,0.04821752,0.04612379,0.04427076
@Lloyd_WallFlour what ima grown ass blood ? Lil Wayne n tht song its good,0.3372957929968834,13,6,31,0,51,0.11336751,0.065802865,0.05365051,0.05277186,0.051703047
"👏THIS. ""@masnRoch: Am I the only person who pictures Tropical Storm Arthur as a short drunken millionaire in a top hat? #JustWondering”",0.3522774577140808,22,12,25,0,41,0.10254939,0.075845204,0.07102818,0.05188795,0.050966732
Flood damage cleanup continues in  Hunterdon after Hurricane Irene http://t.co/DAXoa9f via http://t.co/EFpM4XP,0.20891271904110909,32,55,62,33,43,0.05071515,0.044973396,0.03976137,0.03957237,0.033890437
Joe Girardi will greet fans who donate items for Hurricane Sandy relief efforts tomorrow. ” @NinjaZenMaster here is your chance!,0.38939540833234787,33,50,53,21,7,0.105097495,0.0871837,0.070168905,0.06845809,0.05848722
"Isaac expected to become hurricane in gulf, hurling high wind and surge into Tampa Bay - http://t.co/FG4yViq6 #Gandy #Florida",0.26050998270511627,33,31,12,40,53,0.0675594,0.06409135,0.0529379,0.03830881,0.037612528
I've decided not to evacuate despite hurricane warnings. I'm gonna ride Irene out on the back deck. #beerandcigarstolast3days,0.277971550822258,31,30,33,57,62,0.068449475,0.06433716,0.059346024,0.04346758,0.042371314
"THIS IS THE STORM OF A LIFETIME, brought to you by some old people selling heart pills #theweatherchannel #sandy",0.7896946612745523,11,48,46,59,8,0.4321487,0.25005063,0.06288387,0.022311492,0.022299971
Sandy castle... Not the storm. #bajunids  @ Teluk Chempedak http://t.co/AQcO7E4D,0.1819646954536438,33,55,34,32,24,0.041192487,0.039697595,0.03558389,0.033088557,0.032402165
Attention New Yorkers! Don't bother trying to find any hot Cheetos or Takis. I have them all :-) not even hurricane Sandy could stop me.,0.3298925645649433,38,56,58,55,57,0.13451359,0.07387278,0.04520736,0.038877305,0.037421532
"Dose not feel like a Monday. Finally, Hurricane Isaac in the rear view. #EatTrainWorkRepeat",0.23849088326096535,33,17,31,30,40,0.06895241,0.050970756,0.04731181,0.037222352,0.034033556
I didnt know there was a hurricane named sandy. Thats my late paternal grandfather.,0.3695034421980381,12,25,22,19,34,0.1250057,0.08697548,0.07128829,0.04930345,0.03693052
@jacquesbornman there's rugby on?,0.45067836716771126,50,41,9,12,54,0.13797282,0.10423969,0.07462151,0.07255794,0.06128641
“@Reuters: U.S. jobless claims surge in wake of superstorm Sandy http://t.co/joZ6idHt” #Sandy #ObamaPresser,0.20624898374080658,0,32,55,12,40,0.049285553,0.042698458,0.042317566,0.036653813,0.035293594
3 Tax Smart Ways To Give To Hurricane Harvey Relief https://t.co/F1foQukgOA https://t.co/l2N1BLD69b,0.23041735962033272,33,20,53,40,32,0.05605329,0.052763496,0.04772101,0.037341747,0.03653782
It's going to get worse before it gets better! (@ Frankenstorm Apocalypse - Hurricane Sandy w/ @tommysutch) [pic]: http://t.co/SOZUHXgt,0.21140555664896965,24,39,52,33,51,0.05075465,0.04700191,0.04055269,0.040540792,0.032555513
Tweet dreams @OregonMedicMike . I love you! #up48hour #hurricane #Isaac,0.5142506808042526,24,47,59,8,61,0.15455171,0.09818141,0.0941507,0.08576123,0.08160563
"Alert-Update: Tropical Storm - Harvey, Advisory 29, WATCH, Max Winds 65kph/40mph, Gusts of 83kph/52mph https://t.co/vQLnl3M7jt",0.33185866475105286,12,32,33,62,31,0.092699416,0.069992736,0.06807186,0.05619826,0.044896394
"But, #LSU had a lot to deal with this week with Hurricane Isaac. Hopefully they worked out the kinks in this game.",0.30882545933127403,21,62,12,10,22,0.108985975,0.06712518,0.056031004,0.039148714,0.037534587
"#Hurricane #Sandy: Jersey City #Boardwalk #Collapses, leaves people ponder on reasons of Mother Nature's fury. http://t.co/eBf4LiT1",0.33000610768795013,32,55,58,33,37,0.0958553,0.09469904,0.056739073,0.042762343,0.03995035
"I'm at Hurricane Irene (Moving Target, Washington) w/ 40 others http://t.co/E7BLJca",0.20186129212379456,62,20,12,10,53,0.049387503,0.041934274,0.03848892,0.038180374,0.03387022
Halloween dos G's :  Gustav fantasiado de porquinho ou de urso assassino & Georg fantasiado de vagina.,0.27150164544582367,51,44,6,24,30,0.09580441,0.059383523,0.041517794,0.039824568,0.034971353
Everybody's focused on Hurricane Irene and in sneaks a 5.9 mag earthquake. #MotherNatureInCharge,0.2664704844355583,12,62,25,22,19,0.099835314,0.047240335,0.04682394,0.039069965,0.03350093
"I am praying for those affected by Hurricane Sandy, and I ask my partners to agree in prayer for protection for those in the storm's path.",0.7265931069850922,21,46,34,61,8,0.5365593,0.056072216,0.045068618,0.044468157,0.044424832
I can't believe there is actually a Hurricane Sandy Twitter. What has this world come to,0.4321405328810215,12,25,28,34,3,0.231396,0.062375296,0.052092504,0.043665186,0.042611543
"Hurricane Sandy u aint shit, we dont like ur rain",0.3937782421708107,56,38,48,37,1,0.1677735,0.07417462,0.053972397,0.053620998,0.044236727
Prayers for Hurricane Sandy victims... (at Vinny and Kae's) [pic] — http://t.co/hEAnNBWt,0.6637463495135307,21,46,34,5,47,0.38972396,0.10074058,0.084179595,0.045040514,0.0440617
gustele a quien le gustele,0.2738012298941612,58,55,11,38,42,0.0792533,0.056717057,0.052923318,0.044833302,0.04007425
Am I the only one who considers Irene a tropical storm. These leople don't know what a mother storm is,0.31218647211790085,12,25,22,19,62,0.09239491,0.0745765,0.050747786,0.050632857,0.04383442
#fatigue,0.20951864309608936,24,47,61,57,4,0.08243538,0.04112979,0.028896153,0.028721187,0.028336136
People who is being affected by hurricane sandy go vote... Because if #Romney win fema is out tge door... And all that help is n will b gone,0.3039463944733143,34,46,21,33,32,0.079726934,0.073127635,0.06621275,0.044604015,0.04027506
RNC? No thanks I'll watch Bones reruns & hurricane updates. Anxious enough over #Isaac.,0.24239122867584229,62,33,10,53,50,0.06454955,0.049157135,0.043950547,0.04249728,0.042236716
Really though who names a hurricane sandy? #seriouslythough,0.3766343332827091,19,25,12,1,38,0.08689594,0.086301655,0.08229812,0.067105055,0.05403356
RT @Raspberry_Pi: New SD card update (adds 512MB support): http://t.co/VXhom3rl,0.28515808284282684,17,33,41,40,34,0.07001142,0.06341444,0.059875198,0.047313448,0.044543575
Help Hurricane Sandy Victims and Long Islanders in Need Enjoy Holiday Feasts http://t.co/PiALkXex via http://t.co/y1c6xRum,0.4535085279494524,21,34,27,47,5,0.20098665,0.1347226,0.054564197,0.032460824,0.030774249
"Before I rushed out the door to evacuate for Hurricane Matthew, I took this shot. I didn't know… https://t.co/KCHf22nWH7",0.31835250556468964,12,25,20,19,62,0.09236184,0.06853716,0.06282218,0.05030764,0.04432369
