Text,Top5%,Emoji_1,Emoji_2,Emoji_3,Emoji_4,Emoji_5,Pct_1,Pct_2,Pct_3,Pct_4,Pct_5
Stay safe my gulf cost friends! RT @CDC_DrCPortier: #Isaac now a category 1 #hurricane. Stay tuned to TV/radio for #evacuation info,0.3113235682249069,16,33,30,31,21,0.093481265,0.059057128,0.057258658,0.05268534,0.04884118
"Avella Grades City, ConEd on Hurricane Irene Response via",0.2561053894460201,33,40,0,53,20,0.08763616,0.061503086,0.038832363,0.035558734,0.03257505
"""@Sinnerman24: Hurricane #Sandy aka #Frankenstorm is posing the worst case scenario for east coast. Stay Safe! All ! """,0.34302803315222263,21,17,33,40,34,0.16080774,0.06573741,0.05851969,0.029258732,0.028704455
Hush..hush.. RT@TelegraphNews: Hurricane Sandy: 17 people rescued off HMS Bounty replica ship,0.25188061594963074,22,25,0,1,49,0.05880712,0.05528521,0.046879016,0.04554183,0.04536744
""" What if gangam style was actually just a giant rain dance and we brought this hurricane on ourselves? #Sandy” @wirtwormdangler",0.4434957094490528,0,51,12,40,20,0.23850542,0.06714013,0.060488038,0.03910388,0.038258236
Hurricane Matthew tore the end of the pier off & left debris all…,0.3216889724135399,34,12,46,5,3,0.1102693,0.07354048,0.060739476,0.038571175,0.03856854
@FraserSinc92 nah she is. Dragged in by hurricane Sandy,0.29009147733449936,51,0,20,25,12,0.09887442,0.084544994,0.036577214,0.036030117,0.034064732
Looks scary... “@mashable: Hurricane Irene: NASA Posts Satellite View of Irene's Landfall In N.C. [UPDATED] - ”,0.32697246223688126,52,41,12,34,43,0.096390076,0.066134594,0.061602715,0.054308005,0.04853707
susahnya buat mejamkan mata ini .-.,0.298304945230484,24,55,35,42,58,0.08644772,0.06191795,0.054081857,0.051849537,0.04400788
С Машей не всё ок,0.2509699612855911,11,21,48,57,34,0.0861676,0.049222548,0.043149456,0.04253795,0.029892411
"Hurricane Sandy, 'Frankenstorm' Preparation Advice from the Twitterverse via",0.32322798296809196,33,11,6,40,31,0.1079393,0.06694061,0.06009916,0.04610064,0.04214827
Sending prayers to all of those in the path of hurricane Isaac. 🙏,0.7301874496042728,21,61,8,59,46,0.37280366,0.13518842,0.08122886,0.08115606,0.059810456
"Hey guys, Sandy is not a sand storm. Wtf. 😠",0.39336904510855675,55,32,12,19,25,0.110759296,0.10857774,0.062400352,0.062033873,0.04959778
I made a cake for hurricane sandy hahaha lmfao,0.36657825112342834,0,53,36,40,20,0.12337496,0.06546362,0.06444707,0.056703888,0.056588717
5 Things to Do to Prepare for Hurricane Sandy via,0.2199700064957142,20,62,12,45,52,0.051522505,0.05121177,0.04121766,0.038174916,0.037843157
"😎Some local 🏄surfers and advanced beginners enjoying part of 🌀Hurricane Florence's 🌊swell at our home break, last week's #tbt📹 by caribbeansurfadventure @ Macao Surf Camp",0.32107219472527504,33,31,53,11,57,0.13575925,0.071000874,0.0496439,0.034149006,0.030519165
How to Clean up After Hurricane Sandy via,0.2436606101691723,19,45,25,43,52,0.052248564,0.051575284,0.049249176,0.046212792,0.044374794
"#sandy #hurricane ♫ ""Shelter from the Storm"" by @bobdylan (@ Chalfant Boro)",0.4312016908079386,11,48,33,40,17,0.15123543,0.14045107,0.06942556,0.040774807,0.029314818
Helping You While You Help Others: Hurricane Sandy has in one way or another affected us all. As we start ...,0.306965671479702,44,61,57,47,58,0.11541621,0.060249064,0.04919577,0.044197895,0.037906736
Driving Still Dicey 2 Days After Hurricane Sandy - #WestHempstead #NewYork,0.21033208817243576,12,52,62,31,42,0.052404627,0.04503374,0.040456362,0.036277555,0.036159802
When are people going to start blaming hurricane sandy on Obama?,0.46633724868297577,25,22,12,19,0,0.12811162,0.1045468,0.087232076,0.07330543,0.07314133
We hope everyone is staying safe and out of the way of Hurricane Sandy!,0.47974327206611633,21,8,61,59,47,0.17778312,0.08600953,0.08067563,0.06827885,0.06699614
"""@twc_hurricane: As of 8:20pm, a buoy in the eastern eyewall of #Arthur reports 65mph winds gusting to 81mph.",0.39975716546177864,12,32,55,25,19,0.12044532,0.11463126,0.072451055,0.050046463,0.04218307
@charlotteartsx was je gister nog op tijd meis voor #MSA12 ?,0.29903992265462875,54,50,53,24,20,0.07893179,0.067728564,0.06414763,0.045336213,0.042895723
@Nick_Jonesy7 @lewis_tonks @rolandobloom8 it's all about china garden at the whitminster inn #topchinese,0.4012083262205124,33,36,54,50,31,0.108058654,0.08197029,0.074021734,0.07256475,0.0645929
Hurricane sandy there I said it,0.23027624562382698,12,31,9,0,44,0.05701109,0.054108713,0.040825274,0.039209206,0.039121963
Oficialmente 2 semanas en NY....Grateful that my family is safe after hurricane Maria....but…,0.37223074212670326,21,34,46,8,47,0.14061056,0.088295594,0.05480271,0.045956906,0.042564973
CHECK OUT THIS PIC – taken from the Space Station of Hurricane Sandy: via @gretawire,0.287648007273674,33,50,41,31,54,0.078442834,0.05607058,0.054125328,0.05324118,0.045768086
Why name hurricane fag names like Sandy? Name that shit Hurricane Death Megatron300 n I guarantee niggas be evacuating that shit.-KWilliams,0.3390256054699421,13,51,38,42,0,0.11650675,0.073420085,0.05847201,0.05519271,0.035434052
The sun coming out post Hurricane Sandy!!! #statigram #igdaily #instabest #instamood #instadaily @ New York,0.23351717740297318,31,33,4,21,17,0.07638819,0.0465343,0.0393327,0.036499884,0.034762107
Ok. Milk - checkBread - checkEggs - eggsI'm ready for Hurricane Sandy. Wait. What. WTF I missed it. That's it. French Toast Anyone ?,0.3629673011600971,32,55,25,19,52,0.09892765,0.09663106,0.060335625,0.058895912,0.04817706
Hurricane Irene's pending arrival sends OEM offices into high gear - #Warren #NewJersey,0.19441905058920383,33,31,11,44,12,0.047742594,0.04320719,0.04299783,0.03108571,0.029385727
"With Hurricane Irene Bearing Down, Maryland Governor Talks With Obama, Implores 'Preparedne via",0.21367046236991882,33,12,25,32,22,0.051920936,0.044296153,0.042503044,0.038310923,0.036639407
Blackingout cos of hurricane sandy? Why not #messedupmonday,0.260566771030426,26,9,54,0,50,0.06882914,0.056990124,0.05338036,0.042589504,0.038777642
'Frankenstorm': Hurricane Sandy May Hit Sunday via,0.2156289778649807,31,40,41,12,17,0.047709525,0.043484025,0.042147648,0.04185418,0.0404336
The eye of the storm...Nashville : midnight...Hurricane Harvey takes a break for a minute.…,0.24511960707604885,41,11,12,33,48,0.076998316,0.059424426,0.045418445,0.035723396,0.027555024
At work now at University Hospital . Full activation by 7 am tomorrow in preparation for the arrival of hurricane Isaac.,0.23825301229953766,52,42,43,39,62,0.05432471,0.053740293,0.047072876,0.04244762,0.040667515
Hurricane Matthew is headed for Haiti. Let's take a moment to pray.…,0.7315321378409863,21,17,61,8,40,0.59891623,0.06297961,0.03700548,0.016453419,0.016177397
Sandy hurricane AND a snowstorm #thatshitcray,0.2536882683634758,11,12,4,6,48,0.06817962,0.060480013,0.044758588,0.040375363,0.03989468
รถติดจังเลยค่าาาาา (@ Express Way),0.27472858130931854,11,21,48,33,50,0.07180956,0.068475895,0.063615575,0.038430363,0.03239719
#trolllollol #hurricane #sandy is really #FSU here in #bellingham too! #wwu #fall #pacificNW @ Viking Union,0.3432415649294853,33,61,57,53,40,0.09930551,0.07119378,0.06736097,0.05303556,0.05234575
"@thenameisjuls oh, semi-hand-me-downs lol but they smoe dope polos and such, totally my style, and i dont really have much 4 a wardrobe lol",0.31766096875071526,54,53,20,10,62,0.07189961,0.06879966,0.06348792,0.058427818,0.055045966
#CelioLatAmCover Hurricane Irene gains strength,0.714410268701613,57,17,41,58,13,0.64929324,0.020537727,0.015971072,0.0147775635,0.013830663
"how does a hurricane bring cold weather & snow?? come here, sandy!! I want snow! :)",0.2944364547729492,55,32,24,29,61,0.08539116,0.069721356,0.050873723,0.046651796,0.041798424
#happyfourth #arthur #hurricane #boston @ Southend,0.21242434903979301,57,40,11,33,58,0.048292927,0.045329217,0.04357682,0.039992798,0.035232585
"(#Yeremiito21) Keeping Hurricane Arthur out of the house: 6am Pine Island, Outer Banks NC (Via @Yeremiix3)",0.3111293502151966,33,31,63,11,50,0.08108597,0.07413258,0.06842909,0.044209752,0.04327196
My nigga @ObeyProdigy back at it again i see...lol,0.44878431037068367,41,13,31,57,44,0.18409443,0.083796024,0.0673343,0.060309257,0.053250298
So thankful I was able to vote today via fax. Hurricane #sandy can't stop my vote!! #hobokenvote,0.3502193093299866,17,21,61,57,33,0.09895808,0.098865286,0.05446801,0.05117193,0.046756003
@Kaitlynx17 It's so on! I'll go all Hurricane Sandy on your scrawny little ass! ;),0.3574155233800411,58,57,24,54,33,0.10493289,0.067302525,0.06519293,0.062303226,0.057683952
"Haiti: Hurricane Matthew leaves hundreds dead, 'worst yet to come'",0.28607236966490746,46,34,27,3,35,0.09403053,0.080654584,0.042373035,0.03573665,0.03327757
Why do I have so many clothes and crap! Just always comes back and takes ages to clean up! FML,0.5133457779884338,29,42,55,32,43,0.13451208,0.11554968,0.10921638,0.08875077,0.06531686
"Was hoping to bring my nephew to his first football game today, but thanks to Hurricane Florence he wasn’t able to make it 😕 still a great experience at the…",0.39746613055467606,61,5,33,34,27,0.14611217,0.06526271,0.064014785,0.061536383,0.060540076
I'm at Hurricane Irene w/ @kenissomewhere,0.22292764857411385,36,10,31,62,4,0.07423675,0.042768322,0.039692957,0.034182213,0.032047406
@WWF_addict I didn't have class this week due to hurricane sandy! So no homework for me! 😜 Does that make you feel better lol :) hehe!,0.37097815051674843,54,53,10,50,33,0.10084041,0.08605322,0.06818961,0.060918834,0.05497607
National Weather Service Compares Sandy to Devastating ’62 Storm via,0.3808492496609688,34,46,27,52,45,0.12727706,0.09255121,0.06403083,0.050019316,0.04697083
Hurricane Sandy Bits and Bytes: State unemployment compensation centers closed today. via,0.283175703138113,32,33,34,55,19,0.07586554,0.060387954,0.053160984,0.052792363,0.040968865
President Trump is making his way back to Texas to visit those impacted by Hurricane Harvey.,0.2597905322909355,12,33,51,40,25,0.05943121,0.05476328,0.050792895,0.04774897,0.047054175
Romney's raving about privatizing FEMA. Probably good time for Americans to decide if idea is rational after Hurricane Sandy. #debate,0.2640581503510475,33,22,62,54,25,0.062162887,0.06134318,0.05431188,0.04359127,0.042648938
Hurricane Isaac is roaring about. (@ Keesler West Falcon),0.2297109290957451,61,33,50,40,57,0.061352387,0.045110866,0.043250903,0.04241119,0.037585583
RT @gemswinc @slines Ha..there is also @hurricane_irene @weatherfran @elegantdame// OMG~not two hurricanes! @Irene @Ants_SNEweather,0.2890823893249035,54,50,41,33,12,0.07568025,0.07273615,0.049179688,0.048484884,0.043001417
"Besides the sensitivity, is the practical - apparently hotels are housing those left homeless by the superstorm Sandy. No room for runners.",0.27440573275089264,22,25,27,62,19,0.095114395,0.06209018,0.040477175,0.039503828,0.037220154
Summary of Bloomberg hurricane update: don't be an idiot #Irene,0.2804890424013138,19,55,32,25,33,0.075997524,0.06267287,0.057624914,0.045000527,0.03919321
Preparing for my first hurricane #Sandy,0.29380078613758087,62,57,10,12,20,0.08511013,0.057825394,0.057517715,0.051183663,0.042163886
@karamel2197 unless the cellphone tower falls,0.3474768027663231,50,54,9,62,41,0.12670243,0.070842326,0.05872915,0.04783667,0.04336623
"Hurricane briefing, here comes #Isaac looks like PR is out of the cone of un @ US Fish and Wildlife Service",0.28946972265839577,22,12,25,34,19,0.08081165,0.05809452,0.057336017,0.050613105,0.04261443
"To all of my family & friends in the probable path of HURRICANE FLORENCE, please download the ZELLO APP to communicate through any potential WiFi/electricity…",0.4266474675387144,21,33,34,53,7,0.2835447,0.053057417,0.033862453,0.02816471,0.028018197
"Irene strengthens over Puerto Rico, becoming the 1st hurricane of the 2011 Atlantic season. Minimum central pressure 987mb",0.24604541063308716,57,33,31,17,40,0.065684706,0.057573397,0.044504035,0.040282685,0.038000587
"Dear Hurricane Sandy, Bitch, u better pack a punch, I received an email, tht my interview ws cancelled on Monday. Its hard 2 get n 2 ths co.",0.5818191021680832,32,55,58,37,19,0.19332887,0.16424774,0.107320696,0.07534811,0.04157369
"""@GUBLERNATION: hearts and prayers are with NYC and all those in the path of hurricane sandy"" ♥",0.60178592056036,21,46,8,47,59,0.19107792,0.120242886,0.11583969,0.08944957,0.08517586
@Real_Liam_Payne Follow me or I will send hurricane sandy to the uk. I TAKE THAT BACK BBY IM SORRY,0.25112083181738853,18,34,43,27,5,0.057337888,0.053487014,0.047715273,0.047227453,0.045353204
Soo I guess hurricane Irene is headed towards va beach Wtf smh,0.4842562898993492,19,1,32,55,37,0.11827976,0.11355837,0.08962156,0.08234859,0.08044801
Make the Most of Your Cell Phone During Hurricane Irene via,0.17973784171044827,20,33,0,19,51,0.0385684,0.03832356,0.036194067,0.03571931,0.030932507
Vamos ver o pôr do sol Me dê a mão 🎶🎵☀️#picofftheday #bsb #brasilia #paranoa #vacation #trip…,0.30694481171667576,11,48,21,57,58,0.12453988,0.068391375,0.043412905,0.039987657,0.030612992
Hurricane Florence survival pack. We are open Tuesday and Wednesday unless things change. Do you know where all your yarn is in case of emergency?#theyarnclub #survivalkit #hurricane…,0.2316248081624508,62,12,54,50,22,0.05284836,0.05043358,0.047255866,0.042999238,0.038087763
"Merecerá la pena, seguro.",0.3005616031587124,57,24,58,6,33,0.120756984,0.05596375,0.051214408,0.037957244,0.034669217
Mayor Menino Announces Assistance to Home and Business Owners Affected by Hurricane Sandy: Mayor Thomas M. Menin...,0.2645297348499298,33,32,40,55,34,0.085583694,0.04905448,0.04670921,0.04301039,0.04017196
"I'm at Hurricane Irene (moving target, Ricmond) w/ 6 others",0.17520439065992832,20,62,42,12,53,0.045165572,0.037550054,0.031388957,0.03126102,0.029838787
"@cnnbrk: Arthur has become a hurricane, the National Weather Service says. It has maximum sustained winds of 75 mph. """,0.3725990392267704,12,25,22,32,19,0.09082917,0.08525812,0.075166635,0.06804097,0.053304147
UPDATE AL basin: HURRICANE IRENE CAT: 3 @ 06:00UTC | Loc: 28.7N -77.3W | Winds: 115mph | Moving: N @ 14mph | Pressure: 942mb,0.2002493366599083,25,24,62,42,31,0.044249024,0.043553337,0.040213022,0.036135465,0.036098488
Tropical storm Isaac 💦🌀,0.34041664376854897,4,11,61,48,33,0.11219244,0.07196008,0.06021548,0.048916027,0.047132622
@Barrila_A @dannyfarinasays @mikeyofthesand I got brews baby,0.3757925480604172,31,50,9,23,44,0.095167,0.08526787,0.08102773,0.06575918,0.04857076
Hurricane Sandy Relief Effort via,0.2838898152112961,33,40,17,20,15,0.067168,0.060822107,0.055759788,0.053607948,0.046531975
Most dramatic photos from Hurricane Irene - #Bridgeport #Connecticut,0.18851514905691147,0,12,28,20,53,0.04598458,0.041980695,0.03641534,0.033850428,0.030284107
"RT @twc_hurricane: Winds gusting up to 68 mph in Cleveland, Ohio. #Sandy",0.3220100477337837,12,41,3,0,29,0.10093955,0.0726721,0.061843153,0.050415836,0.03613941
Dallas Cowboys raise over $2 million Hurricane Harvey relief SalvationArmy…,0.30003613233566284,61,17,40,57,33,0.083146304,0.069410294,0.052530367,0.047566306,0.04738286
Recap | UK — Did Gay Sex Cause Hurricane Harvey or Was it Climate Change? Some On the Right Blame LGBT ... - And…,0.22310911118984222,41,22,25,19,32,0.06681307,0.048773397,0.042264987,0.034629267,0.030628394
"PRT @Nightwing16: ""I'm glad I had an extra pair of Depends with me."" - Mike Seidel The Weather Channel #irene #hurricane",0.23660584539175034,33,40,0,31,53,0.060722034,0.0551223,0.04378007,0.041296396,0.035685044
My #hurricane survival plan. #sandy #weather #moms #picoftheday #instapic #wine #n @ Bradley Food & Beverage,0.2229146547615528,33,57,36,24,6,0.060996022,0.05493413,0.03888861,0.036302473,0.03179342
@aidancain123 safe bro,0.8506329637020826,58,13,57,21,33,0.69764316,0.059500072,0.03510378,0.032758076,0.025627876
Don't forget! Heart & Soul is postponed due to Hurricane Matthew. Please be safe!!! @ Trinity Miami,0.5889465697109699,21,46,34,61,8,0.26969665,0.12484819,0.10546071,0.04946388,0.03947714
"I'm kinda excited about dis potential hurricane Sandy! Anyway, #GM, busy day ahead...",0.3053033798933029,53,33,10,7,57,0.0681276,0.06562769,0.0595035,0.056659337,0.055385254
Town Prepares For Hurricane Sandy via,0.20899458229541779,33,31,6,30,12,0.06953942,0.038682446,0.035604432,0.032868747,0.032299537
Working 0700-1600. Hurricane preparedness. #Bring_it_on_Isaac. (@ Academy Sports & Outdoors),0.23104337975382805,57,33,42,45,20,0.06391876,0.054769516,0.043927107,0.035775423,0.03265257
Bumped into Prof Brian Cox at #mgeitf - asked him about global impact of hurricane Irene - he said things can only get wetter.,0.28945693001151085,12,0,54,53,25,0.07353806,0.064237155,0.056396578,0.04847589,0.04680925
"Morris County nonprofit says money, cat food donations needed after Hurricane Sandy via",0.23036181181669235,0,19,25,51,12,0.06681243,0.042136222,0.04204628,0.039845556,0.03952132
#NowWatching hurricane #Irene news on CNN,0.2867259569466114,33,34,12,40,53,0.08625305,0.05468352,0.05326785,0.05005477,0.042466767
Hurricane Irene Strands Dozens Of Chihuahuas In San Francisco via,0.21232666447758675,33,12,31,11,62,0.054705273,0.049858294,0.040639427,0.04023129,0.026892379
Hurricane sandy's on da way,0.28707411140203476,31,44,57,13,6,0.09171013,0.066799864,0.04866721,0.041931145,0.037965763
"Superstorm Sandy: Lehigh Valley starts to reopen, schools staying closed - Get Updates Here - #Bloomsbury #NewJersey",0.22163868695497513,33,61,40,31,50,0.06665111,0.05027046,0.036138963,0.03469955,0.0338786
Hurricane Sandy destroyed the Jersey shores seaside house #nowwhat #wherearetheygonnaparty?,0.38803843036293983,12,41,22,25,0,0.17327099,0.0761304,0.053570617,0.043333575,0.041732855
Surviving hurricane sandy 1 on 1 #ScaryShit,0.23461344093084335,12,57,33,62,20,0.06880981,0.050771452,0.041758046,0.037169117,0.036105018
UPDATE AL basin: TROPICAL STORM ISAAC @ 12:00UTC | Loc: 15.7N -58.4W | Winds: 45mph | Moving: W @ 19mph | Pressure: 1004mb,0.19635439664125443,44,62,32,55,37,0.06137354,0.03892567,0.033506893,0.033496913,0.029051382
"Dear Hurricane Sandy, I WILL not let you ruin my day! So u can just stop trying",0.39892973378300667,38,55,32,56,58,0.112115525,0.08615303,0.08263762,0.06786629,0.050157268
County Begins Preparations for Threat of Hurricane Irene via,0.19714685156941414,12,44,62,33,51,0.04430128,0.04340833,0.038495854,0.035804387,0.035137
"Summer storms, many thanks to Hurricane Arthur for this spectacular sky activity. #SouthCarolina…",0.36396127939224243,61,21,33,8,47,0.11016038,0.085079856,0.067727506,0.05119567,0.049797866
@aaashe “Hurricane Sandy; today a huge rainbow over Boston. (pic @NewMusicCo)”Light at the end of the tunnel! #faith,0.5110430307686329,21,63,33,59,61,0.248384,0.072495386,0.06897014,0.06317367,0.058019843
“@SandysHurricane: FOUR FOR YOU HURRICANE SANDY! YOU GO HURRICANE SANDY! AND NONE FOR HURRICANE IRENE BYE.” 😂😂😂😂😂😂😂😂😂😂😂😂😂,0.2946565970778465,30,40,33,58,61,0.093754,0.07105693,0.05294734,0.041956168,0.034942158
Hurricane Irene: Rockland State Of Emergency Kicks In At 6 p.m. via,0.3027059957385063,12,33,41,62,20,0.12218064,0.04961673,0.046911336,0.04600964,0.037987646
I'm at Frankenstorm Apocalypse - Hurricane Sandy w/ @kurt,0.2552645467221737,11,51,31,48,42,0.06257209,0.05889271,0.053123817,0.042242873,0.038433056
Hurricane sandy trashes the jersey shore? Sounds like nature is getting even with us for putting those arrogant guidos on tv..,0.35338133201003075,12,22,25,19,62,0.09474853,0.08033153,0.0784977,0.053011376,0.0467922
#Twitter has been the best info source during #Hurricane #Irene,0.4545113034546375,33,40,6,17,13,0.17733222,0.08499264,0.07659067,0.06308808,0.052507687
Hurricane sandy on this treadmill - HIT Training,0.4474239982664585,57,12,58,20,45,0.2867503,0.043541044,0.04225828,0.040239267,0.03463512
DJing tonight at Mansion Night Club in Brick for a Hurricane Sandy Benefit. I go on at 11 - come out! #restoretheshore,0.406548697501421,11,31,17,44,33,0.13829446,0.084092915,0.06525233,0.06499057,0.053918425
Hurricane Sandy: (Almost) Everything’s Canceled via,0.2118506170809269,12,20,33,25,19,0.04698406,0.046374787,0.045034066,0.038414456,0.035043247
Hurricane Matthew Forces Travelers To Change Boston-Bound Flights,0.19227080047130585,12,41,62,33,25,0.05850485,0.037752952,0.032542694,0.031800263,0.03167004
"Для меня, при выборе отдыха, приоритетом является место, а именно город. Например, можно жить в…",0.4152285233139992,21,11,48,57,63,0.12955141,0.090521455,0.073745385,0.06696457,0.054445706
"When there is a hurricane i only watch GLADIATOR, wow what a great movie #russelcrowe #joaquinphoenix #irene sleep well @SaucyGlossie",0.3540155589580536,14,33,40,6,53,0.11202869,0.10386027,0.06760658,0.036017075,0.034502946
Goya O Boya! #hurricane sandy food donation is enormous to United Way of Hudson County!,0.3000873476266861,40,33,53,24,57,0.07223608,0.070153795,0.05442575,0.054045502,0.049226217
Gators upset by hurricane irene #hurricaneirene,0.3128427378833294,61,40,12,33,17,0.0972494,0.07912571,0.0648784,0.036437213,0.035152014
I'm at Hurricane Irene,0.20682210847735405,12,0,20,25,51,0.04638403,0.042851612,0.04196596,0.040127657,0.03549285
WHY hurricane sandy did you have to make my day today the biggest pain in the ass,0.336512953042984,32,29,46,55,34,0.07699871,0.07294601,0.06453611,0.06401135,0.05802077
Jewish Federation Establishes Hurricane Sandy Victims' Fund via,0.18526935577392578,33,24,34,11,47,0.04645266,0.040679682,0.033681404,0.032945253,0.031510357
#Favorite  love Drake. <3,0.42844509333372116,48,11,4,8,47,0.15942141,0.1011709,0.060322527,0.055958625,0.05157163
Alright... the National Hurricane Center has pushed the track of Isaac westward in agreement with (cont),0.2389361411333084,19,33,40,32,20,0.054701306,0.049960412,0.045814343,0.044361617,0.044098463
"#Bloody #rain thanks to #Florence storm (@ Times Square in New York, NY)",0.24740668386220932,33,53,21,24,16,0.06817721,0.04814713,0.04683068,0.046171978,0.038079686
Hurricane Irene Buffets City As Tornado Watch Remains In Effect - #Queens #NewYork,0.21988100185990334,33,12,31,41,53,0.066394284,0.04472781,0.03917663,0.036392838,0.03318944
Season 2 Finale of The Newsroom - Hurricane Sandy.,0.32563963159918785,34,46,40,3,33,0.10688634,0.101686195,0.04287278,0.038020797,0.03617352
FEMA Lays Out Guidelines for Obtaining Advance Payments After Hurricane Matthew #FEMA #Answers,0.16862653940916061,33,12,0,20,62,0.03648159,0.034220327,0.03410528,0.032550562,0.031268783
@SirisUK when your mums does summin clumsy/drastic/mental you should refer to her as hurricane sandy.,0.2388947233557701,25,50,62,0,54,0.051562477,0.048711948,0.047953628,0.04601509,0.04465158
@KevinHart4real donated 100k to the Hurricane #Sandy relief effort!! Awesome job!!,0.6081900782883167,33,40,57,53,7,0.24361376,0.1843117,0.071411006,0.067986146,0.04086746
Hurricane Matthew: Obama declares state of emergency in North Carolina,0.3701610900461674,12,41,33,17,51,0.2039781,0.046280812,0.04571873,0.03873378,0.03544966
Hurricane Sandy ain't got shit on these,0.32635289803147316,56,51,0,13,14,0.07985499,0.07773673,0.07228526,0.053688116,0.04278781
"Because today is a rainy day, as hurricane Olivia is passing by, we need to wait for another day of blue ocean. ...#blueocean #honoluluhawaii #waves #surfing #surfers #diamondhead…",0.6009924858808517,61,11,48,21,47,0.35550144,0.14834026,0.044487193,0.028344376,0.024319218
Preparing for hurricane sandy.,0.18281158432364464,62,10,20,33,21,0.043898143,0.039125465,0.03732287,0.031789534,0.030675571
Represent. (@ Zone C Park Slope Hurricane Irene),0.2973920442163944,58,30,57,11,48,0.09485567,0.06072225,0.058321327,0.043204255,0.040288538
"RT ""@dwimeily: BIGRT @desoot Ya allah ini memang nasip ku :"" jngan ulangi lagi""",0.4652615077793598,16,24,47,34,0,0.20150502,0.13904873,0.05125529,0.047121905,0.026330568
My prayers go out to all the hurricane sandy victims!,0.7621791549026966,21,61,46,5,8,0.5716359,0.05849508,0.04541578,0.043474153,0.04315824
"Who Da Boss? Hurricane Irene, Long Island NY August 2011 via",0.44078491628170013,41,31,44,13,57,0.13847144,0.1245139,0.07485123,0.06706819,0.035880156
Hurricane Thursdays be like........ #Matthew #Hurricane #Storm #Aruba #Caribbean #beachlife…,0.1556047536432743,57,31,11,20,54,0.03796386,0.03333976,0.028967923,0.028066885,0.027266325
40% chance of a hurricane forming again. I doubt many people are going to take a mandatory evacuation seriously again! #irene,0.49711379781365395,32,55,37,19,52,0.2129853,0.13904345,0.054614738,0.05202741,0.03844289
Someone's not worried about hurricane Arthur yet #dogsandtheirblankies,0.2756400667130947,41,12,0,62,9,0.0912778,0.055513382,0.048048418,0.040690217,0.04011025
Local organizations collecting donations for Hurricane Sandy victims - #Princeton #NewJersey,0.21077166125178337,33,21,31,61,30,0.067647584,0.04175735,0.03468929,0.033567816,0.033109624
"“@albertmohler: Please join me in praying this morning for the over 60 million people in the path of Hurricane Sandy, now at 85 mph winds.”",0.6726154424250126,21,17,40,12,52,0.50162643,0.08836788,0.03613624,0.029249538,0.017235354
Texas mom dies saving her infant daughter during Hurricane Harvey flooding,0.36143452674150467,51,0,12,19,20,0.10516356,0.10049167,0.055278275,0.051292483,0.049208537
Volvo Announces Program For Cars Lost Or Damaged In Hurricane Sandy: Volvo Cars of North America (VCNA) exten...,0.20352192595601082,33,32,31,54,55,0.06085697,0.0396138,0.03662655,0.035756283,0.030668326
